[
    {
        "comments": "Supplies Sent 7/19/21",
        "guid": "EAF5F9A6-A622-0F91-3206-28316287A31D",
        "modifiedDateTime": "2021-07-19 11:23:30",
        "clientGuid": "6DBD7978-1D3E-03F6-76B5-74FC2604E0D5",
        "loggedUser": "cal.jmo",
        "createdDateTime": "2021-07-19 04:07:30"
    },
    {
        "comments": "Supplies Sent 9/22/21",
        "guid": "F50AA13E-89F6-DB38-903B-9BF4C0C6AFA2",
        "modifiedDateTime": "2021-09-22 09:55:49",
        "clientGuid": "D97EA755-7D7A-55AC-AAF6-5D0B6599F0D9",
        "loggedUser": "cal.jmo",
        "createdDateTime": "2021-09-22 02:09:49"
    },
    {
        "comments": "Supplies Sent 9/22/21",
        "guid": "69DC90CC-1535-DB19-1802-3A574EFD3CD5",
        "modifiedDateTime": "2021-09-22 10:01:52",
        "clientGuid": "0000B59F-F8BE-5055-122A-36C32835ACD7",
        "loggedUser": "cal.jmo",
        "createdDateTime": "2021-09-22 03:09:52"
    },
    {
        "comments": "Supplies Sent 8/17/21",
        "guid": "90564843-17E8-3647-C9BF-460A1F47CBB7",
        "modifiedDateTime": "2021-08-17 15:51:57",
        "clientGuid": "A97D47AB-9DF5-2E5A-11F2-C45BFC59D793",
        "loggedUser": "cal.jmo",
        "createdDateTime": "2021-08-17 08:08:57"
    },
    {
        "comments": "Supplies Sent 7/21/21",
        "guid": "47B06B2B-1985-62D0-D241-05FB60D18B6F",
        "modifiedDateTime": "2021-07-21 12:38:36",
        "clientGuid": "FABA0090-EE0C-0C0B-7933-BE4B478ABF7E",
        "loggedUser": "cal.jmo",
        "createdDateTime": "2021-07-21 05:07:36"
    },
    {
        "comments": "Supplies Sent 8/13/21",
        "guid": "02788534-C9F5-94F7-0781-8135C5DBB583",
        "modifiedDateTime": "2021-08-13 12:21:31",
        "clientGuid": "20209A31-A4E0-127A-F81F-7EA5D85275B5",
        "loggedUser": "cal.jmo",
        "createdDateTime": "2021-08-13 05:08:31"
    },
    {
        "comments": "Supplies Sent 6/23/21",
        "guid": "E4210702-696C-FBD6-760A-150DA4C36F4D",
        "modifiedDateTime": "2021-06-23 14:11:34",
        "clientGuid": "5DFC05D4-C535-D0C8-D4C5-03F2443199A7",
        "loggedUser": "cal.jmo",
        "createdDateTime": "2021-06-23 07:06:34"
    },
    {
        "comments": "Health coach text sent.",
        "guid": "B9FCD44E-199B-B704-373C-7E230D093709",
        "modifiedDateTime": "2021-08-24 13:28:17",
        "clientGuid": "7A703F6B-4414-3B9D-B688-1626BB1C423F",
        "loggedUser": "eri.bro",
        "createdDateTime": "2021-08-24 06:08:17"
    },
    {
        "comments": "Supplies Sent 9/30/21",
        "guid": "A2976974-F28F-CE1B-C102-790EBD2808BB",
        "modifiedDateTime": "2021-09-30 09:09:22",
        "clientGuid": "6DBD7978-1D3E-03F6-76B5-74FC2604E0D5",
        "loggedUser": "cal.jmo",
        "createdDateTime": "2021-09-30 02:09:22"
    },
    {
        "comments": "Supplies Sent 8/30/21",
        "guid": "4F37E9B9-AE4E-0C98-2593-7EE05C38394D",
        "modifiedDateTime": "2021-08-30 15:25:21",
        "clientGuid": "79F345AF-A9FE-0D98-734B-6FA8FA00C099",
        "loggedUser": "cal.jmo",
        "createdDateTime": "2021-08-30 08:08:21"
    },
    {
        "comments": "Supplies Sent 9/7/21",
        "guid": "D7E5E8A9-5BAE-27AC-B214-04AADB26EE12",
        "modifiedDateTime": "2021-09-07 15:15:41",
        "clientGuid": "D543483A-76D2-4F1B-179F-2A64C4378034",
        "loggedUser": "cal.jmo",
        "createdDateTime": "2021-09-07 08:09:41"
    },
    {
        "comments": "Supplies Sent 6/22/21",
        "guid": "91797A01-FDF7-1020-83B5-B87204702D19",
        "modifiedDateTime": "2021-06-22 10:06:24",
        "clientGuid": "6A699FA2-74F4-F8FE-85D4-E5E3163DBB9B",
        "loggedUser": "cal.jmo",
        "createdDateTime": "2021-06-22 03:06:24"
    },
    {
        "comments": "Supplies Sent 9/28/21",
        "guid": "1358708F-27C6-9F34-0FD7-47538D233FE1",
        "modifiedDateTime": "2021-09-28 10:01:36",
        "clientGuid": "F069ACC8-7514-D798-AD28-CB052DA830DD",
        "loggedUser": "cal.jmo",
        "createdDateTime": "2021-09-28 03:09:36"
    },
    {
        "comments": "Supplies Sent 9/28/21",
        "guid": "A422A497-56BB-A0EF-5BC2-96A0C0D8D295",
        "modifiedDateTime": "2021-09-28 10:03:30",
        "clientGuid": "1D0A1E75-6768-1C6A-876C-830D2BEF44EC",
        "loggedUser": "cal.jmo",
        "createdDateTime": "2021-09-28 03:09:30"
    },
    {
        "comments": "Supplies Sent 6/23/21",
        "guid": "7F889741-FC8B-4093-F39A-7297F07279FE",
        "modifiedDateTime": "2021-06-23 12:50:29",
        "clientGuid": "081FF7D6-DC79-EEE3-ACF4-0CBA62DA0E7D",
        "loggedUser": "cal.jmo",
        "createdDateTime": "2021-06-23 05:06:29"
    },
    {
        "comments": "Supplies Sent 9/28/21",
        "guid": "26475B99-2765-6E1A-2374-FA93BFA9F3BD",
        "modifiedDateTime": "2021-09-28 10:08:29",
        "clientGuid": "3B868ED6-C85C-F9D2-C06B-DA9BD8C92562",
        "loggedUser": "cal.jmo",
        "createdDateTime": "2021-09-28 03:09:29"
    },
    {
        "comments": "Supplies Sent 9/23/21",
        "guid": "305E98AC-05DC-40AC-3C74-94DCA1C62139",
        "modifiedDateTime": "2021-09-23 10:49:13",
        "clientGuid": "41EEACDD-E45E-D577-E6CE-CDD7412B4F1E",
        "loggedUser": "cal.jmo",
        "createdDateTime": "2021-09-23 03:09:13"
    },
    {
        "comments": "Supplies Sent 8/2/21",
        "guid": "904DF40A-1CF4-A470-5D68-F89E45A287B0",
        "modifiedDateTime": "2021-08-02 11:35:07",
        "clientGuid": "5C0F01F4-B0EB-C9D1-A9F2-C8B62BA3AF57",
        "loggedUser": "cal.jmo",
        "createdDateTime": "2021-08-02 04:08:07"
    },
    {
        "comments": "Health coach daily text sent.",
        "guid": "75A51AED-3790-2FFD-9831-FE32B4F001E9",
        "modifiedDateTime": "2021-08-16 15:12:26",
        "clientGuid": "31B62788-5F36-E99F-2BDF-A4C845FD347E",
        "loggedUser": "eri.bro",
        "createdDateTime": "2021-08-16 08:08:26"
    },
    {
        "comments": "Supplies Sent 8/31/21",
        "guid": "ACC77E9A-EB69-586E-827C-A50D0624CAC9",
        "modifiedDateTime": "2021-08-31 13:39:51",
        "clientGuid": "BE495638-4BCC-3F40-0254-7A5E240B087F",
        "loggedUser": "cal.jmo",
        "createdDateTime": "2021-08-31 06:08:51"
    },
    {
        "comments": "Supplies Sent 8/4/21",
        "guid": "141184BD-568E-A6E3-6B6A-369B38D29F44",
        "modifiedDateTime": "2021-08-04 11:40:31",
        "clientGuid": "36FE8CE8-3645-5B54-C238-56DB0D7E39F9",
        "loggedUser": "cal.jmo",
        "createdDateTime": "2021-08-04 04:08:31"
    },
    {
        "comments": "Supplies Sent 6/10/21",
        "guid": "3825322E-E006-C7BC-C895-349C260E2375",
        "modifiedDateTime": "2021-06-10 10:07:36",
        "clientGuid": "1BB3E216-BC80-17B9-9D40-20858DDD5715",
        "loggedUser": "cal.jmo",
        "createdDateTime": "2021-06-10 03:06:36"
    },
    {
        "comments": "Supplies Sent 9/23/21",
        "guid": "8E9D67F8-E1E5-BC4B-371D-37D87942D44C",
        "modifiedDateTime": "2021-09-23 09:48:19",
        "clientGuid": "DE4E6D5F-1DC3-2F31-DF77-FC61F3AA2F4E",
        "loggedUser": "cal.jmo",
        "createdDateTime": "2021-09-23 02:09:19"
    },
    {
        "comments": "Supplies Sent 9/27/21",
        "guid": "4C748552-53EC-49CB-71A6-E83D1C4E709F",
        "modifiedDateTime": "2021-09-27 10:10:28",
        "clientGuid": "F9D9D112-4D1F-9E22-E32B-408929AF5F03",
        "loggedUser": "cal.jmo",
        "createdDateTime": "2021-09-27 03:09:28"
    },
    {
        "comments": "Supplies Sent 8/2/21",
        "guid": "83FE3025-9A39-89F0-BBD8-97D060BD6D01",
        "modifiedDateTime": "2021-08-02 11:18:09",
        "clientGuid": "F92ED64C-91CD-38F4-600E-0BD52A174A06",
        "loggedUser": "cal.jmo",
        "createdDateTime": "2021-08-02 04:08:09"
    },
    {
        "comments": "Called and left vm with Pt. to return my call.",
        "guid": "94C8CEE1-61B8-3A06-7EF9-FCA71022EABE",
        "modifiedDateTime": "2021-03-11 11:45:55",
        "clientGuid": "1BB3E216-BC80-17B9-9D40-20858DDD5715",
        "loggedUser": "eri.bro",
        "createdDateTime": "2021-03-11 05:03:55"
    },
    {
        "comments": "Health Coach daily reminder sent to patient.",
        "guid": "FF990448-CEE0-4E99-51A6-08400BAD8C03",
        "modifiedDateTime": "2021-09-17 18:05:04",
        "clientGuid": "1BB3E216-BC80-17B9-9D40-20858DDD5715",
        "loggedUser": "mar.vam",
        "createdDateTime": "2021-09-17 11:09:04"
    },
    {
        "comments": "Pt. called about a trouble shooting error with Device. We fixed it and took BP while on phone.",
        "guid": "95D160FE-BC0D-8564-0130-458869594EA2",
        "modifiedDateTime": "2021-02-26 18:32:32",
        "clientGuid": "5E13BF44-7A96-C579-5ACF-5D8FCF2AA195",
        "loggedUser": "eri.bro",
        "createdDateTime": "2021-02-27 12:02:32"
    },
    {
        "comments": "Health Coach daily reminder sent to patient.",
        "guid": "A7D9686D-6E24-9B1E-2FBA-041EA1D0E486",
        "modifiedDateTime": "2021-09-13 15:33:54",
        "clientGuid": "5E13BF44-7A96-C579-5ACF-5D8FCF2AA195",
        "loggedUser": "mar.vam",
        "createdDateTime": "2021-09-13 08:09:54"
    },
    {
        "comments": "Made an appointment with PT. 09-09-20",
        "guid": "595C51A3-8323-CCFD-796C-57BDBCCFD9B6",
        "modifiedDateTime": "2020-09-08 13:30:13",
        "clientGuid": "9F4D7D11-3D8C-7F17-A6C8-7B36C7C062B0",
        "loggedUser": "ter.bmo",
        "createdDateTime": "2020-09-08 06:09:13"
    },
    {
        "comments": "Health coach sent reminder to patient",
        "guid": "CE9C06BB-9615-D7BC-5F61-C7620A1610B8",
        "modifiedDateTime": "2021-09-01 15:04:01",
        "clientGuid": "CB8B79A8-AD82-7421-3A70-4768B5ABA04B",
        "loggedUser": "ed.est",
        "createdDateTime": "2021-09-01 08:09:01"
    },
    {
        "comments": "Health coach sent reminder to patient",
        "guid": "E6FD0053-013F-8759-0101-E296446AE7D7",
        "modifiedDateTime": "2021-10-05 16:51:47",
        "clientGuid": "1D0A1E75-6768-1C6A-876C-830D2BEF44EC",
        "loggedUser": "ed.est",
        "createdDateTime": "2021-10-05 09:10:47"
    },
    {
        "comments": "Health coach sent reminder to patient",
        "guid": "06473814-47F1-6EEC-18F8-F61895EAE54E",
        "modifiedDateTime": "2021-10-05 16:49:57",
        "clientGuid": "A27E49FC-BF36-55DA-B5BE-8AB7EA6A1D00",
        "loggedUser": "ed.est",
        "createdDateTime": "2021-10-05 09:10:57"
    },
    {
        "comments": "Health Coach called patient, patient did not answer, LVM, sent message, requesting wellness visit",
        "guid": "64FDDF26-9907-A918-0548-FA8891DA2BF6",
        "modifiedDateTime": "2021-10-06 11:25:18",
        "clientGuid": "F7CA979E-FD2A-3A4A-47E2-E765B82D1916",
        "loggedUser": "ed.est",
        "createdDateTime": "2021-10-06 04:10:18"
    },
    {
        "comments": "Health Coach daily reminder sent to patient.",
        "guid": "3904A560-1082-BDC6-AA8D-5456E1347C44",
        "modifiedDateTime": "2021-10-07 14:43:56",
        "clientGuid": "28A4C20C-1471-EC1A-CBA3-BFF6F5BF1D6C",
        "loggedUser": "ed.est",
        "createdDateTime": "2021-10-07 07:10:56"
    },
    {
        "comments": "Health Coach daily reminder sent to patient.",
        "guid": "5140B29D-3984-D395-EB68-016E4BAD308C",
        "modifiedDateTime": "2021-10-07 14:44:06",
        "clientGuid": "2040A71D-7651-8B58-A0B1-EB2AB911DEC9",
        "loggedUser": "ed.est",
        "createdDateTime": "2021-10-07 07:10:06"
    },
    {
        "comments": "Health Coach daily reminder sent to patient.",
        "guid": "576A25CD-FEC3-D67E-566C-C55F370225E7",
        "modifiedDateTime": "2021-10-07 14:38:42",
        "clientGuid": "DF0F4F3E-8D77-B949-F02B-1D6DA7F5BE82",
        "loggedUser": "ed.est",
        "createdDateTime": "2021-10-07 07:10:42"
    },
    {
        "comments": "Health Coach daily reminder sent to patient.",
        "guid": "F22FBE9B-29F0-5468-540D-08B34BC6518C",
        "modifiedDateTime": "2021-10-07 14:35:21",
        "clientGuid": "781750CD-CB11-D9D1-4EBC-60528AC36BE0",
        "loggedUser": "ed.est",
        "createdDateTime": "2021-10-07 07:10:21"
    },
    {
        "comments": "Health Coach sent weekend reminder",
        "guid": "05ECD98D-DE79-0280-2AFB-4B6882A784AD",
        "modifiedDateTime": "2021-10-09 12:52:00",
        "clientGuid": "D5EF7E4A-77E2-ABB6-AD44-8BEAB4BC86AC",
        "loggedUser": "ed.est",
        "createdDateTime": "2021-10-09 05:10:00"
    },
    {
        "comments": "Health Coach sent weekend reminder",
        "guid": "D301DEE3-A65E-3B71-3949-27EA47A2287D",
        "modifiedDateTime": "2021-10-09 12:40:12",
        "clientGuid": "134ABA65-9B48-3301-6528-637EA13264AD",
        "loggedUser": "ed.est",
        "createdDateTime": "2021-10-09 05:10:12"
    },
    {
        "comments": "Health Coach sent weekend reminder",
        "guid": "E9190284-5870-9101-A501-BC91583D5967",
        "modifiedDateTime": "2021-10-09 12:47:40",
        "clientGuid": "B4D7CAF0-6B69-2B8B-6633-178C4288478B",
        "loggedUser": "ed.est",
        "createdDateTime": "2021-10-09 05:10:40"
    },
    {
        "comments": "Health Coach called patient, patient did not answer, LVM, sent message",
        "guid": "867BC78A-1455-A012-E072-B606E708D0C1",
        "modifiedDateTime": "2021-10-08 14:17:17",
        "clientGuid": "668EE559-D8EB-C51E-D05B-DA1388B07E4C",
        "loggedUser": "ed.est",
        "createdDateTime": "2021-10-08 07:10:17"
    },
    {
        "comments": "Health Coach daily reminder sent to patient.",
        "guid": "8A69D0E5-1D27-0688-9A56-51A082395365",
        "modifiedDateTime": "2021-10-11 17:31:40",
        "clientGuid": "46E6EEC5-6A5F-E894-6426-A40BB6682544",
        "loggedUser": "ed.est",
        "createdDateTime": "2021-10-11 10:10:40"
    },
    {
        "comments": "Health coach sent reminder to patient",
        "guid": "E9A709AB-5AB0-DED1-511F-0B0EB4192372",
        "modifiedDateTime": "2021-10-11 17:37:46",
        "clientGuid": "35BFF7E6-44FD-4E9A-8CCE-7660EE3CECDE",
        "loggedUser": "ed.est",
        "createdDateTime": "2021-10-11 10:10:46"
    },
    {
        "comments": "Health Coach called patient, patient did not answer, LVM",
        "guid": "50DBA74F-B9EE-79F1-0DB6-37110E26ACE6",
        "modifiedDateTime": "2021-10-11 17:53:21",
        "clientGuid": "E64F26CC-481E-2D69-2747-312782F7CD31",
        "loggedUser": "ed.est",
        "createdDateTime": "2021-10-11 10:10:21"
    },
    {
        "comments": "Patient called health coach to inform him that she is in the hospital, patient is expecting to be released tonight, patient will get back on track with readings starting tomorrow",
        "guid": "2734DDC2-DE55-7C5E-D795-7B2748D308C0",
        "modifiedDateTime": "2021-10-11 17:48:48",
        "clientGuid": "CE87162D-9666-B82B-076B-DBE9FAA642A7",
        "loggedUser": "ed.est",
        "createdDateTime": "2021-10-11 10:10:48"
    },
    {
        "comments": "Supplies Sent 10/11/21",
        "guid": "C03E1D75-DA9E-3C7B-4BD4-5ADE738773E2",
        "modifiedDateTime": "2021-10-11 16:07:01",
        "clientGuid": "19585885-C5BC-4621-80A5-40776BA95CC9",
        "loggedUser": "cal.jmo",
        "createdDateTime": "2021-10-11 09:10:01"
    },
    {
        "comments": "Supplies Sent 8/30/21",
        "guid": "50082C02-8DF4-0D3F-36F5-BFB94F31B33E",
        "modifiedDateTime": "2021-08-30 15:29:45",
        "clientGuid": "12203256-C572-B565-A3D0-738A22A67C6D",
        "loggedUser": "cal.jmo",
        "createdDateTime": "2021-08-30 08:08:45"
    },
    {
        "comments": "Supplies Sent 9/28/21",
        "guid": "5BA1D5AF-2056-9B8E-7A40-C72272294EB0",
        "modifiedDateTime": "2021-09-28 09:44:37",
        "clientGuid": "E4AA069D-7A7B-3D4D-8D58-5597149CB4EA",
        "loggedUser": "cal.jmo",
        "createdDateTime": "2021-09-28 02:09:37"
    },
    {
        "comments": "Supplies Sent 9/24/21",
        "guid": "EA396221-EA4F-567E-25AD-C28F6EB55B05",
        "modifiedDateTime": "2021-09-24 09:01:19",
        "clientGuid": "A59D0431-3B46-02DF-2843-824C8BCE97AD",
        "loggedUser": "cal.jmo",
        "createdDateTime": "2021-09-24 02:09:19"
    },
    {
        "comments": "Supplies Sent 6/24/21",
        "guid": "94F503D7-9967-4368-2DAA-FF6818FEB867",
        "modifiedDateTime": "2021-06-24 12:46:51",
        "clientGuid": "84966C96-171C-CFED-6838-C5ADE399870D",
        "loggedUser": "cal.jmo",
        "createdDateTime": "2021-06-24 05:06:51"
    },
    {
        "comments": "Health coach text sent.",
        "guid": "9FEC750B-FE13-DC7B-3069-CC51E487E196",
        "modifiedDateTime": "2021-08-24 12:23:38",
        "clientGuid": "FD5E2C26-AD16-A58C-FA59-21C1895303A4",
        "loggedUser": "eri.bro",
        "createdDateTime": "2021-08-24 05:08:38"
    },
    {
        "comments": "Supplies Sent 10/14/21",
        "guid": "8C8636F5-F25F-8880-7134-C68CB718A321",
        "modifiedDateTime": "2021-10-14 15:35:40",
        "clientGuid": "B658F1C3-F339-A1FC-F515-543D89BCF735",
        "loggedUser": "cal.jmo",
        "createdDateTime": "2021-10-14 08:10:40"
    },
    {
        "comments": "Supplies Sent 6/28/21",
        "guid": "18CDCDC5-EB67-79A6-32DB-26F2DC3238D0",
        "modifiedDateTime": "2021-06-28 15:01:05",
        "clientGuid": "57E67477-B0A2-532D-741D-988AC8D7F874",
        "loggedUser": "cal.jmo",
        "createdDateTime": "2021-06-17 08:06:29"
    },
    {
        "comments": "Supplies Sent 9/28/21",
        "guid": "F52DB65D-D1EF-B754-00F3-05A38EF5572F",
        "modifiedDateTime": "2021-09-28 10:06:35",
        "clientGuid": "C14D8966-2E59-B9AB-2646-D2ED01450183",
        "loggedUser": "cal.jmo",
        "createdDateTime": "2021-09-28 03:09:35"
    },
    {
        "comments": "Health coach reminder sent.",
        "guid": "E3A6BCAB-4A28-8EA7-E939-19577A65C235",
        "modifiedDateTime": "2021-08-12 16:18:57",
        "clientGuid": "E4F54F02-D94D-C647-7A1E-42C88E02BED8",
        "loggedUser": "eri.bro",
        "createdDateTime": "2021-08-12 09:08:57"
    },
    {
        "comments": "Wellness call made to Pt. left a vm for BP to be checked today.",
        "guid": "1D30F046-2568-E5B4-AAD4-2049FAE6BD1B",
        "modifiedDateTime": "2021-03-26 16:05:04",
        "clientGuid": "C4F70518-EA84-4EC0-42E9-4FE32558416C",
        "loggedUser": "eri.bro",
        "createdDateTime": "2021-03-26 09:03:04"
    },
    {
        "comments": "Health coach vm left with Pt. regarding compliance & asked that the Pt. return my call asap.",
        "guid": "6E7040E5-9085-F2D9-32FD-55A273DCF8B9",
        "modifiedDateTime": "2021-08-17 13:05:33",
        "clientGuid": "78263BFD-80DA-11AC-C91F-5A7CF0C8C4F1",
        "loggedUser": "eri.bro",
        "createdDateTime": "2021-08-17 06:08:33"
    },
    {
        "comments": "Patient texted me that her father passed away but she would check her glucose levels.",
        "guid": "E5C657CA-150D-02B3-EA21-BE0652689274",
        "modifiedDateTime": "2021-08-30 16:35:58",
        "clientGuid": "78263BFD-80DA-11AC-C91F-5A7CF0C8C4F1",
        "loggedUser": "eri.bro",
        "createdDateTime": "2021-08-30 09:08:58"
    },
    {
        "comments": "Charger Sent 9/15/21",
        "guid": "CC205390-ABB5-74F4-BE88-5DF12B1EC29A",
        "modifiedDateTime": "2021-09-15 08:45:38",
        "clientGuid": "93829541-0CD0-9ADE-51D9-815208B9AAD2",
        "loggedUser": "cal.jmo",
        "createdDateTime": "2021-09-15 01:09:27"
    },
    {
        "comments": "Health coach Call, no answer, lvm, and sent message.  Patient responded stating monitor needs to be charged and then will provide today's reading.",
        "guid": "DDCD347C-7601-AD22-FDA0-E86A6B728FFD",
        "modifiedDateTime": "2021-08-17 15:15:19",
        "clientGuid": "78263BFD-80DA-11AC-C91F-5A7CF0C8C4F1",
        "loggedUser": "mar.vam",
        "createdDateTime": "2021-08-17 08:08:19"
    },
    {
        "comments": "Called patient but got no answer, sent a daily text reminder.",
        "guid": "4AB38584-4426-E1A9-1CCA-B97E380F67C8",
        "modifiedDateTime": "2021-08-11 12:00:38",
        "clientGuid": "78263BFD-80DA-11AC-C91F-5A7CF0C8C4F1",
        "loggedUser": "eri.bro",
        "createdDateTime": "2021-08-11 05:08:38"
    },
    {
        "comments": "Area manager will be making a wellness check visit this week to Pt. home.",
        "guid": "C813A3A8-C5FC-51D0-077D-D017CC8713C6",
        "modifiedDateTime": "2021-08-23 12:03:54",
        "clientGuid": "78263BFD-80DA-11AC-C91F-5A7CF0C8C4F1",
        "loggedUser": "eri.bro",
        "createdDateTime": "2021-08-23 05:08:54"
    },
    {
        "comments": "Health coach reminder sent.",
        "guid": "77E15DDB-91B0-ECFF-AEF1-6A217A7A060C",
        "modifiedDateTime": "2021-08-12 17:25:39",
        "clientGuid": "96E56114-1D35-4FA5-FB9B-A8EAAEC83F20",
        "loggedUser": "eri.bro",
        "createdDateTime": "2021-08-12 10:08:39"
    },
    {
        "comments": "Health coach call made to Pt. vm was left asking that she return my call asap.",
        "guid": "99DD6907-0AB7-3C59-6B90-5356377F67DB",
        "modifiedDateTime": "2021-08-09 12:22:00",
        "clientGuid": "78263BFD-80DA-11AC-C91F-5A7CF0C8C4F1",
        "loggedUser": "eri.bro",
        "createdDateTime": "2021-08-09 05:08:00"
    },
    {
        "comments": "Supplies Sent 9/27/21",
        "guid": "007AE695-8DF0-E68D-860F-A4418D03CA96",
        "modifiedDateTime": "2021-09-27 09:07:28",
        "clientGuid": "0D57244C-7A56-82D7-E0D2-AC0403A26360",
        "loggedUser": "cal.jmo",
        "createdDateTime": "2021-09-27 02:09:28"
    },
    {
        "comments": "Health Coach Director, called patient, no answer, lvm and sent message.",
        "guid": "2AB72110-87B0-E278-3CEE-B58A3D094548",
        "modifiedDateTime": "2021-09-10 14:09:03",
        "clientGuid": "78263BFD-80DA-11AC-C91F-5A7CF0C8C4F1",
        "loggedUser": "mar.vam",
        "createdDateTime": "2021-09-10 07:09:03"
    },
    {
        "comments": "Health coach text reminder sent.",
        "guid": "FCE6455B-A27C-D863-6663-ED55EAB96D42",
        "modifiedDateTime": "2021-09-07 12:09:21",
        "clientGuid": "78263BFD-80DA-11AC-C91F-5A7CF0C8C4F1",
        "loggedUser": "eri.bro",
        "createdDateTime": "2021-09-07 05:09:21"
    },
    {
        "comments": "Health Coach called patient, patient did not answer, LVM, sent message",
        "guid": "2947D4CC-6428-7679-8551-A91EA0569B65",
        "modifiedDateTime": "2021-09-29 16:18:42",
        "clientGuid": "78263BFD-80DA-11AC-C91F-5A7CF0C8C4F1",
        "loggedUser": "ed.est",
        "createdDateTime": "2021-09-29 09:09:42"
    },
    {
        "comments": "Daily text reminder sent from health coach.",
        "guid": "C2C804E1-3270-3A0C-EDB5-E39D634F0031",
        "modifiedDateTime": "2021-08-31 10:04:45",
        "clientGuid": "78263BFD-80DA-11AC-C91F-5A7CF0C8C4F1",
        "loggedUser": "eri.bro",
        "createdDateTime": "2021-08-31 03:08:45"
    },
    {
        "comments": "Called patient but got no answer, sent a daily text reminder.",
        "guid": "9213F6B8-A54E-01EB-B9BD-B4937F52EF4E",
        "modifiedDateTime": "2021-08-10 12:20:53",
        "clientGuid": "78263BFD-80DA-11AC-C91F-5A7CF0C8C4F1",
        "loggedUser": "eri.bro",
        "createdDateTime": "2021-08-10 05:08:53"
    },
    {
        "comments": "Health Coach called patient, patient states that she is unable to provide a reading for today",
        "guid": "5C32CBF1-87ED-8E75-AC62-09BFFA8ECF02",
        "modifiedDateTime": "2021-09-25 12:24:13",
        "clientGuid": "78263BFD-80DA-11AC-C91F-5A7CF0C8C4F1",
        "loggedUser": "ed.est",
        "createdDateTime": "2021-09-25 05:09:13"
    },
    {
        "comments": "Health Coach Daily Reminder Sent To Patient.",
        "guid": "F7107338-3973-F864-1A41-A993102D71B3",
        "modifiedDateTime": "2021-09-13 18:42:54",
        "clientGuid": "C8D4B05F-02FB-261D-F3AA-F60933156F6D",
        "loggedUser": "mar.vam",
        "createdDateTime": "2021-09-13 11:09:54"
    },
    {
        "comments": "Wellness/compliance visit made to patientâ€™s home. Provided patient some additional diabetic supplies, obtain successful blood pressure reading. Reconnected to health coach. Patient agrees to text reminders.",
        "guid": "2AC1C1BA-80F1-1964-A975-6A948BD89013",
        "modifiedDateTime": "2021-08-25 14:28:15",
        "clientGuid": "78263BFD-80DA-11AC-C91F-5A7CF0C8C4F1",
        "loggedUser": "cor",
        "createdDateTime": "2021-08-25 07:08:15"
    },
    {
        "comments": "Supplies Sent 6/29/21",
        "guid": "E5B1E93B-5C18-E1A5-6087-0889681468C7",
        "modifiedDateTime": "2021-06-29 09:06:57",
        "clientGuid": "874822CC-B22C-8F64-FBA9-44C1224A9578",
        "loggedUser": "cal.jmo",
        "createdDateTime": "2021-06-29 02:06:57"
    },
    {
        "comments": "Health Coach daily reading reminder sent to patient.",
        "guid": "D34F0E53-94D8-685D-1CD0-9085E19E3482",
        "modifiedDateTime": "2021-09-21 16:57:28",
        "clientGuid": "FD6F2DC2-E227-3211-D90F-9A8F3A570DCF",
        "loggedUser": "mar.vam",
        "createdDateTime": "2021-09-21 09:09:28"
    },
    {
        "comments": "Pt. was concerned with her BP being a little higher the last few days.  Talked with Corey and he checked. her readings.  The readings have been a bit high but overall consistent in the same range.  I will have Corey follow up with her next week.",
        "guid": "A47B57AA-7385-EC91-9EF1-B2759F79B468",
        "modifiedDateTime": "2020-10-02 17:33:10",
        "clientGuid": "FD6F2DC2-E227-3211-D90F-9A8F3A570DCF",
        "loggedUser": "ter.bmo",
        "createdDateTime": "2020-10-02 10:10:10"
    },
    {
        "comments": "Health Coach called, regarding missed readings, could not lvm and sent message.",
        "guid": "536B88B5-A38A-52ED-3046-E9634D6BA51A",
        "modifiedDateTime": "2021-09-23 18:35:57",
        "clientGuid": "FD6F2DC2-E227-3211-D90F-9A8F3A570DCF",
        "loggedUser": "mar.vam",
        "createdDateTime": "2021-09-23 11:09:57"
    },
    {
        "comments": "Health Coach Call, no answer, left vm and sent message.",
        "guid": "D05EE8A9-ACEE-AFB0-15C7-04D117AD29F4",
        "modifiedDateTime": "2021-08-17 15:21:02",
        "clientGuid": "C12FDA5F-DD89-0E9B-D4B4-895790A35E7F",
        "loggedUser": "mar.vam",
        "createdDateTime": "2021-08-17 08:08:02"
    },
    {
        "comments": "Health coach daily text reminder sent.",
        "guid": "E71283EF-82F9-06F1-7A4C-A233E26A7926",
        "modifiedDateTime": "2021-08-09 16:52:01",
        "clientGuid": "FD6F2DC2-E227-3211-D90F-9A8F3A570DCF",
        "loggedUser": "eri.bro",
        "createdDateTime": "2021-08-09 09:08:01"
    },
    {
        "comments": "Patient stated he would check his vitals and glucose when he gets back to the device. I ordered him Pt. diabetic supplies as well.",
        "guid": "668C8047-DF28-E79C-7978-E557BEF7F6B6",
        "modifiedDateTime": "2021-07-15 13:36:05",
        "clientGuid": "058DBB80-1920-6BEB-CFB9-95C4ED5CF79F",
        "loggedUser": "eri.bro",
        "createdDateTime": "2021-07-15 06:07:05"
    },
    {
        "comments": "Health Coach daily reading reminder sent to patient.",
        "guid": "F3E9D035-DC65-7E13-2176-526CE4259E03",
        "modifiedDateTime": "2021-09-09 16:20:26",
        "clientGuid": "FD6F2DC2-E227-3211-D90F-9A8F3A570DCF",
        "loggedUser": "mar.vam",
        "createdDateTime": "2021-09-09 09:09:26"
    },
    {
        "comments": "Health coach daily text reminder sent.",
        "guid": "2D6334E2-6059-1C0B-7861-E08D8C69FAFF",
        "modifiedDateTime": "2021-09-07 11:57:38",
        "clientGuid": "2647CE17-F4EE-C806-C98A-EEE7C4B4B4DF",
        "loggedUser": "eri.bro",
        "createdDateTime": "2021-09-07 04:09:38"
    },
    {
        "comments": "I called Patient about compliance and reminded her that is has almost been a month since she has checked her BP. I asked that she return my call so I can help her get back on track.",
        "guid": "93171FDA-9085-2132-D602-BFFA7488C02E",
        "modifiedDateTime": "2021-08-02 11:55:00",
        "clientGuid": "2647CE17-F4EE-C806-C98A-EEE7C4B4B4DF",
        "loggedUser": "eri.bro",
        "createdDateTime": "2021-08-02 04:08:00"
    },
    {
        "comments": "Health coach daily reading reminder sent to patient.",
        "guid": "B544A04C-2D38-52B7-E7CD-034A5C5BE935",
        "modifiedDateTime": "2021-09-21 19:35:53",
        "clientGuid": "2647CE17-F4EE-C806-C98A-EEE7C4B4B4DF",
        "loggedUser": "mar.vam",
        "createdDateTime": "2021-09-22 12:09:53"
    },
    {
        "comments": "Health coach call/message left with Pt. asking for her to check her vitals.",
        "guid": "89B391A0-7182-1EB1-498C-8DBFC45574A0",
        "modifiedDateTime": "2021-07-20 13:21:10",
        "clientGuid": "2647CE17-F4EE-C806-C98A-EEE7C4B4B4DF",
        "loggedUser": "eri.bro",
        "createdDateTime": "2021-07-20 06:07:10"
    },
    {
        "comments": "Health Coach daily reading reminder sent to patient.",
        "guid": "B79B83CA-9989-6D1A-2215-6BADBE58184E",
        "modifiedDateTime": "2021-09-09 16:20:33",
        "clientGuid": "2647CE17-F4EE-C806-C98A-EEE7C4B4B4DF",
        "loggedUser": "mar.vam",
        "createdDateTime": "2021-09-09 09:09:33"
    },
    {
        "comments": "Health Coach Call, spoke to patient, states just out of the shower but will provide a reading shortly.",
        "guid": "E66205AB-2D78-652A-ED9A-4CB1769CB75B",
        "modifiedDateTime": "2021-08-11 13:59:06",
        "clientGuid": "2647CE17-F4EE-C806-C98A-EEE7C4B4B4DF",
        "loggedUser": "mar.vam",
        "createdDateTime": "2021-08-11 06:08:06"
    },
    {
        "comments": "Health Coach Director, daily reminder sent to patient.",
        "guid": "55B3EACF-B52A-0620-2DE4-822094294171",
        "modifiedDateTime": "2021-09-10 19:41:56",
        "clientGuid": "96E56114-1D35-4FA5-FB9B-A8EAAEC83F20",
        "loggedUser": "mar.vam",
        "createdDateTime": "2021-09-11 12:09:56"
    },
    {
        "comments": "Patient is in hospital until further notice with fluid on his lungs.",
        "guid": "38068EF4-1C68-E11E-96EB-F6DADDD1A431",
        "modifiedDateTime": "2021-08-03 12:48:26",
        "clientGuid": "28822E40-EC28-06EB-5AAA-A99F31F6FB1D",
        "loggedUser": "eri.bro",
        "createdDateTime": "2021-08-03 05:08:26"
    },
    {
        "comments": "Supplies Sent 9/27/21",
        "guid": "1A41F11D-1AEE-9F3E-87FA-609361D1C9DC",
        "modifiedDateTime": "2021-09-27 10:32:15",
        "clientGuid": "28822E40-EC28-06EB-5AAA-A99F31F6FB1D",
        "loggedUser": "cal.jmo",
        "createdDateTime": "2021-09-27 03:09:15"
    },
    {
        "comments": "Unable to reach Pt. by telephone.",
        "guid": "B648B647-24F1-6492-23DE-C0F51EAEB593",
        "modifiedDateTime": "2021-04-26 09:41:39",
        "clientGuid": "D8410259-71FE-DB72-932F-8C5F3F2F5D99",
        "loggedUser": "eri.bro",
        "createdDateTime": "2021-04-26 02:04:39"
    },
    {
        "comments": "Pt. phone is not accepting calls at this time. I sent a dailt text reminder every day this week.",
        "guid": "E52423DF-4D19-7012-43B8-98B54200EA93",
        "modifiedDateTime": "2021-04-15 14:32:19",
        "clientGuid": "D8410259-71FE-DB72-932F-8C5F3F2F5D99",
        "loggedUser": "eri.bro",
        "createdDateTime": "2021-04-15 07:04:19"
    },
    {
        "comments": "Since the death of the patient, I have not been able to locate the device. Will need to discharge the patient without getting the device.",
        "guid": "330BAEEF-2115-CB37-E77A-7271F8E784EF",
        "modifiedDateTime": "2021-05-10 09:54:27",
        "clientGuid": "D8410259-71FE-DB72-932F-8C5F3F2F5D99",
        "loggedUser": "ter.bmo",
        "createdDateTime": "2021-05-10 02:05:27"
    },
    {
        "comments": "Patient called while he was at pcp office and provided today's reading, nurse standing beside him verified readings. 137 bs, 137/83/94. manually entered so patient would not have to take a second reading for the day.",
        "guid": "87B479C1-D5DB-CC7B-33E5-2CA2F6891E2C",
        "modifiedDateTime": "2021-09-17 17:35:06",
        "clientGuid": "28822E40-EC28-06EB-5AAA-A99F31F6FB1D",
        "loggedUser": "mar.vam",
        "createdDateTime": "2021-09-17 10:09:06"
    },
    {
        "comments": "Pt. stated she would check it later on she is not feeling well right now.",
        "guid": "1A873AE4-1632-6DB4-8FF1-644D11DB0988",
        "modifiedDateTime": "2021-08-04 13:54:06",
        "clientGuid": "8710BC3B-E77E-E557-0304-4BC581D291C6",
        "loggedUser": "eri.bro",
        "createdDateTime": "2021-08-04 06:08:06"
    },
    {
        "comments": "Health Coach Daily Reminder Sent To Patient.",
        "guid": "372FF765-EF97-F5ED-82BC-62F6D21D311E",
        "modifiedDateTime": "2021-09-30 14:47:40",
        "clientGuid": "46E6EEC5-6A5F-E894-6426-A40BB6682544",
        "loggedUser": "ed.est",
        "createdDateTime": "2021-09-30 07:09:40"
    },
    {
        "comments": "Went to do a wellness check, patient had not been responding to calls and texts. I spoke with his friend and they informed me Mr. Moses had passed away.",
        "guid": "7116BBD4-2475-6990-19DC-6F6495F7397A",
        "modifiedDateTime": "2021-05-02 14:33:14",
        "clientGuid": "D8410259-71FE-DB72-932F-8C5F3F2F5D99",
        "loggedUser": "ter.bmo",
        "createdDateTime": "2021-05-02 07:05:14"
    },
    {
        "comments": "Health Coach sent missed reading reminder to patient.",
        "guid": "27B84494-6AE5-3347-7095-066BC4206993",
        "modifiedDateTime": "2021-09-23 19:39:04",
        "clientGuid": "28822E40-EC28-06EB-5AAA-A99F31F6FB1D",
        "loggedUser": "mar.vam",
        "createdDateTime": "2021-09-24 12:09:04"
    },
    {
        "comments": "Supplies Sent 9/15/21",
        "guid": "24BAA5A7-50BA-A6EF-1E91-E159398729BC",
        "modifiedDateTime": "2021-09-15 14:50:16",
        "clientGuid": "7AE636BC-8837-F10A-79BA-F4744447649D",
        "loggedUser": "cal.jmo",
        "createdDateTime": "2021-09-15 07:09:16"
    },
    {
        "comments": "New 3G Device Sent 9/27/21\nID: 5827",
        "guid": "2E2EDACA-4E95-D8CA-FF16-B147C22490B4",
        "modifiedDateTime": "2021-09-27 09:04:32",
        "clientGuid": "288E83D7-9356-20D4-FF05-5A65BD256C89",
        "loggedUser": "cal.jmo",
        "createdDateTime": "2021-09-27 02:09:32"
    },
    {
        "comments": "Patients mother called health coach, patient states monitor is giving PCL, health coach attempted to do a trouble shoot, the mother stated very clearly that she is unable to go through a trouble shoot, requested someone to come out by next week to service the machine, will follow up on the trouble shoot tomorrow",
        "guid": "BC1D822E-A9C8-9437-B120-06D130B05C99",
        "modifiedDateTime": "2021-09-15 15:40:21",
        "clientGuid": "288E83D7-9356-20D4-FF05-5A65BD256C89",
        "loggedUser": "ed.est",
        "createdDateTime": "2021-09-15 08:09:21"
    },
    {
        "comments": "New Device Sent 9/2/21\nID: 0818A",
        "guid": "C6748C38-20BB-B3A9-6B3B-D057943A21C7",
        "modifiedDateTime": "2021-09-02 09:22:11",
        "clientGuid": "C8D4B05F-02FB-261D-F3AA-F60933156F6D",
        "loggedUser": "cal.jmo",
        "createdDateTime": "2021-09-02 02:09:11"
    },
    {
        "comments": "Supplies Sent 6/15/21",
        "guid": "F819B4A9-FAD8-C65E-CC00-37F59170E7A9",
        "modifiedDateTime": "2021-06-15 11:03:40",
        "clientGuid": "0D57244C-7A56-82D7-E0D2-AC0403A26360",
        "loggedUser": "cal.jmo",
        "createdDateTime": "2021-06-15 04:06:40"
    },
    {
        "comments": "Health coach text reminder sent.",
        "guid": "6023C350-D865-9EDC-80DD-0AD1175615B4",
        "modifiedDateTime": "2021-08-26 11:41:58",
        "clientGuid": "96E56114-1D35-4FA5-FB9B-A8EAAEC83F20",
        "loggedUser": "eri.bro",
        "createdDateTime": "2021-08-26 04:08:58"
    },
    {
        "comments": "Health coach daily text reminder sent.",
        "guid": "E63CF591-C3EE-9662-1DAD-EB8FE9A87561",
        "modifiedDateTime": "2021-08-16 10:16:00",
        "clientGuid": "07C23B24-EE28-AEA3-F88A-E975C720B451",
        "loggedUser": "eri.bro",
        "createdDateTime": "2021-08-16 03:08:00"
    },
    {
        "comments": "Called to check on Pt. and he stated he was with Dr. Alazar. He is going to call me and update me on his status.",
        "guid": "DFF55C17-1F13-BBDF-989F-3BB398EB70FB",
        "modifiedDateTime": "2021-05-12 11:08:47",
        "clientGuid": "28822E40-EC28-06EB-5AAA-A99F31F6FB1D",
        "loggedUser": "eri.bro",
        "createdDateTime": "2021-05-12 04:05:47"
    },
    {
        "comments": "Health Coach Director, daily reminder sent to patient.",
        "guid": "2A546DE3-0589-114E-0FF6-63EA8597C817",
        "modifiedDateTime": "2021-09-10 19:32:47",
        "clientGuid": "46E6EEC5-6A5F-E894-6426-A40BB6682544",
        "loggedUser": "mar.vam",
        "createdDateTime": "2021-09-11 12:09:47"
    },
    {
        "comments": "Health coach daily text sent.",
        "guid": "2F1CE067-FFD3-C84B-AE70-083C4124E568",
        "modifiedDateTime": "2021-08-16 15:49:12",
        "clientGuid": "C8D4B05F-02FB-261D-F3AA-F60933156F6D",
        "loggedUser": "eri.bro",
        "createdDateTime": "2021-08-16 08:08:12"
    },
    {
        "comments": "wellness call made to both numbers listed.  left VM.",
        "guid": "F61A806C-A04A-4264-49FF-5EF2E339BB7C",
        "modifiedDateTime": "2020-08-03 14:03:27",
        "clientGuid": "07C23B24-EE28-AEA3-F88A-E975C720B451",
        "loggedUser": "cor",
        "createdDateTime": "2020-08-03 07:08:27"
    },
    {
        "comments": "Supplies Sent 9/23/21",
        "guid": "C77B3A2A-E9E6-FFCD-C99C-8590AB65C538",
        "modifiedDateTime": "2021-09-23 09:43:39",
        "clientGuid": "BE495638-4BCC-3F40-0254-7A5E240B087F",
        "loggedUser": "cal.jmo",
        "createdDateTime": "2021-09-23 02:09:39"
    },
    {
        "comments": "Health coach call made to Pt. left a vm to become more compliant. A dailhy reminder text was sent as well.",
        "guid": "A0942EC6-8701-EA14-6165-94AD9187B954",
        "modifiedDateTime": "2021-04-08 14:06:56",
        "clientGuid": "8710BC3B-E77E-E557-0304-4BC581D291C6",
        "loggedUser": "eri.bro",
        "createdDateTime": "2021-04-08 07:04:56"
    },
    {
        "comments": "Health Coach Director, spoke to patient, agreed to provide today's reading.",
        "guid": "790C7746-9C27-F979-118B-72109B107508",
        "modifiedDateTime": "2021-09-03 19:10:13",
        "clientGuid": "8710BC3B-E77E-E557-0304-4BC581D291C6",
        "loggedUser": "mar.vam",
        "createdDateTime": "2021-09-04 12:09:13"
    },
    {
        "comments": "Supplies Sent 6/22/21",
        "guid": "F81DF887-707D-99C0-6311-0532F18B5F7D",
        "modifiedDateTime": "2021-06-22 09:10:57",
        "clientGuid": "07C23B24-EE28-AEA3-F88A-E975C720B451",
        "loggedUser": "cal.jmo",
        "createdDateTime": "2021-06-22 02:06:57"
    },
    {
        "comments": "Health coach daily reminder sent to patient.",
        "guid": "7F0A4BFB-E137-6832-2331-7485842FE2D1",
        "modifiedDateTime": "2021-09-15 18:20:15",
        "clientGuid": "8710BC3B-E77E-E557-0304-4BC581D291C6",
        "loggedUser": "mar.vam",
        "createdDateTime": "2021-09-15 11:09:15"
    },
    {
        "comments": "I left a vm with Pt. to return my call to do a troubleshooting call to verify if device is working properly. I asked Pt. to return my call.",
        "guid": "34A63D27-D551-4DBC-5A7F-90641966A963",
        "modifiedDateTime": "2021-05-12 15:44:52",
        "clientGuid": "8710BC3B-E77E-E557-0304-4BC581D291C6",
        "loggedUser": "eri.bro",
        "createdDateTime": "2021-05-12 08:05:52"
    },
    {
        "comments": "Patient notified me that her device is not working, needs to be replaced. I will add her to list to receive a new 4G device.",
        "guid": "D6941AD4-4D83-35BB-024F-ED4CD0686F04",
        "modifiedDateTime": "2021-08-20 15:17:41",
        "clientGuid": "C8D4B05F-02FB-261D-F3AA-F60933156F6D",
        "loggedUser": "eri.bro",
        "createdDateTime": "2021-08-20 08:08:41"
    },
    {
        "comments": "Supplies Sent 7/19/21",
        "guid": "7AE44B58-5DDD-6BC0-A255-4C70E2B9FC69",
        "modifiedDateTime": "2021-07-19 14:09:36",
        "clientGuid": "28822E40-EC28-06EB-5AAA-A99F31F6FB1D",
        "loggedUser": "cal.jmo",
        "createdDateTime": "2021-07-19 07:07:36"
    },
    {
        "comments": "Patient informed that she is in the hospital and has been for quite some time. She has a blood clot and some issues with her lungs. She will keep me posted on her condition.",
        "guid": "AB8527E3-A1A3-9D56-A726-049E8450559F",
        "modifiedDateTime": "2021-04-30 15:32:49",
        "clientGuid": "C8D4B05F-02FB-261D-F3AA-F60933156F6D",
        "loggedUser": "eri.bro",
        "createdDateTime": "2021-04-30 08:04:49"
    },
    {
        "comments": "Patient sent message with reading for the day. manually entered. (patient provided readings obtained while at MD office) 123/66/91 bs 126",
        "guid": "0518D20A-F34B-6FC9-67F1-B2E3A50A823C",
        "modifiedDateTime": "2021-09-21 16:34:00",
        "clientGuid": "28822E40-EC28-06EB-5AAA-A99F31F6FB1D",
        "loggedUser": "mar.vam",
        "createdDateTime": "2021-09-21 09:09:00"
    },
    {
        "comments": "I left a vm with Pt. requesting he check his vitals. I told him to return my call and let me know if everything was ok.",
        "guid": "45462BA7-460C-D589-3481-1407FA8A8A84",
        "modifiedDateTime": "2021-04-16 14:12:44",
        "clientGuid": "28822E40-EC28-06EB-5AAA-A99F31F6FB1D",
        "loggedUser": "eri.bro",
        "createdDateTime": "2021-04-16 07:04:44"
    },
    {
        "comments": "Health Coach, spoke with patient, states will provide a reading this evening.",
        "guid": "9490D65D-A533-1C39-04A4-F055D925D89A",
        "modifiedDateTime": "2021-09-23 18:37:03",
        "clientGuid": "C8D4B05F-02FB-261D-F3AA-F60933156F6D",
        "loggedUser": "mar.vam",
        "createdDateTime": "2021-09-23 11:09:03"
    },
    {
        "comments": "Pt. is in the hospital for blood pressure and swollen legs.",
        "guid": "756C23E3-D910-2E14-2C6C-C9E43B0FA5A0",
        "modifiedDateTime": "2021-06-24 12:26:17",
        "clientGuid": "28822E40-EC28-06EB-5AAA-A99F31F6FB1D",
        "loggedUser": "eri.bro",
        "createdDateTime": "2021-06-24 05:06:17"
    },
    {
        "comments": "Supplies Sent 9/28/21",
        "guid": "C9D88DAC-E64A-5A98-0128-0F87FD4A310B",
        "modifiedDateTime": "2021-09-28 09:43:43",
        "clientGuid": "CE25A6AD-0656-5C19-6E07-7AA88F7F898E",
        "loggedUser": "cal.jmo",
        "createdDateTime": "2021-09-28 02:09:43"
    },
    {
        "comments": "Health Coach Director called, no answer, lvm and sent message.",
        "guid": "4F37C3FD-7FF5-AD63-11E9-5E0067D0B0DA",
        "modifiedDateTime": "2021-09-03 16:52:55",
        "clientGuid": "C8D4B05F-02FB-261D-F3AA-F60933156F6D",
        "loggedUser": "mar.vam",
        "createdDateTime": "2021-09-03 09:09:55"
    },
    {
        "comments": "Wellness call made to Pt. regarding compliance. i left a message and asked Pt. to check daily.",
        "guid": "654F440F-05E6-3390-4BF0-66A9AC6B5981",
        "modifiedDateTime": "2021-03-26 16:26:28",
        "clientGuid": "96E56114-1D35-4FA5-FB9B-A8EAAEC83F20",
        "loggedUser": "eri.bro",
        "createdDateTime": "2021-03-26 09:03:28"
    },
    {
        "comments": "Health Coach Director called, no answer, lvm and sent message.",
        "guid": "6D1D56E6-2D31-62C5-EE9F-7A336670FF4B",
        "modifiedDateTime": "2021-09-03 16:58:10",
        "clientGuid": "FE33826B-5B7F-78D3-D433-3778C41DFD03",
        "loggedUser": "mar.vam",
        "createdDateTime": "2021-09-03 09:09:10"
    },
    {
        "comments": "I think we should take him off and not do many reminders.  He is the kind of person that knows more then anyone.  He will continue to take BP 3 times a week.",
        "guid": "8A6D2F28-68BC-2D42-6128-4F1D588F0DE4",
        "modifiedDateTime": "2021-04-05 10:15:31",
        "clientGuid": "FE33826B-5B7F-78D3-D433-3778C41DFD03",
        "loggedUser": "ter.bmo",
        "createdDateTime": "2021-04-05 03:04:31"
    },
    {
        "comments": "Health coach daily text reminder sent.",
        "guid": "D1DD1684-F952-647D-F307-66340DE5B385",
        "modifiedDateTime": "2021-08-13 10:17:10",
        "clientGuid": "07C23B24-EE28-AEA3-F88A-E975C720B451",
        "loggedUser": "eri.bro",
        "createdDateTime": "2021-08-13 03:08:10"
    },
    {
        "comments": "Health coach daily text reminder sent.",
        "guid": "0393EB81-9E36-B8B6-3B22-18210E066D04",
        "modifiedDateTime": "2021-08-27 18:39:55",
        "clientGuid": "07C23B24-EE28-AEA3-F88A-E975C720B451",
        "loggedUser": "mar.vam",
        "createdDateTime": "2021-08-27 11:08:55"
    },
    {
        "comments": "Supplies Sent 9/22/21",
        "guid": "5D46D39D-3ADA-988F-15EC-C8D0768E4A10",
        "modifiedDateTime": "2021-09-22 09:32:20",
        "clientGuid": "07C23B24-EE28-AEA3-F88A-E975C720B451",
        "loggedUser": "cal.jmo",
        "createdDateTime": "2021-09-22 02:09:20"
    },
    {
        "comments": "Patient requested supplies.  verified address.",
        "guid": "CC880208-FD59-6199-9F5C-B1543DCDA48A",
        "modifiedDateTime": "2021-09-21 19:10:23",
        "clientGuid": "07C23B24-EE28-AEA3-F88A-E975C720B451",
        "loggedUser": "mar.vam",
        "createdDateTime": "2021-09-22 12:09:23"
    },
    {
        "comments": "Health Coach daily reading reminder sent to patient.",
        "guid": "F72DF3E6-A05F-CD75-C3A6-908CE731A41F",
        "modifiedDateTime": "2021-09-21 18:31:44",
        "clientGuid": "07C23B24-EE28-AEA3-F88A-E975C720B451",
        "loggedUser": "mar.vam",
        "createdDateTime": "2021-09-21 11:09:44"
    },
    {
        "comments": "Wellness call made to Pt. He stated he has not been feeling well and that's why he has not being taken BP. Pt. stated he would take his BP and sugar today.",
        "guid": "2B5E8B64-2B22-323E-AC15-27FEC3558AF5",
        "modifiedDateTime": "2021-03-04 12:41:45",
        "clientGuid": "28822E40-EC28-06EB-5AAA-A99F31F6FB1D",
        "loggedUser": "eri.bro",
        "createdDateTime": "2021-03-04 06:03:45"
    },
    {
        "comments": "Patient sent message with reading for the day.  manually entered.  (patient provided readings obtained while at MD office) 130/66 88  ad bs 138",
        "guid": "AF5670BF-3240-2917-3CDC-C2A2051D0F8A",
        "modifiedDateTime": "2021-09-10 13:59:41",
        "clientGuid": "28822E40-EC28-06EB-5AAA-A99F31F6FB1D",
        "loggedUser": "mar.vam",
        "createdDateTime": "2021-09-10 06:09:41"
    },
    {
        "comments": "Health Coach daily reminder sent.",
        "guid": "1DAE1907-715B-466C-1DF1-26FF0859D491",
        "modifiedDateTime": "2021-08-16 14:40:14",
        "clientGuid": "28822E40-EC28-06EB-5AAA-A99F31F6FB1D",
        "loggedUser": "eri.bro",
        "createdDateTime": "2021-08-16 07:08:14"
    },
    {
        "comments": "Patient called while he was at pcp office and provided today's reading, nurse standing beside him verified readings.  138 bs, 121/87 hr 99.  manually entered so patient would not have to take a second reading for the day.",
        "guid": "A24D3D35-DC09-BABD-BD73-FFD874B96039",
        "modifiedDateTime": "2021-09-14 13:18:04",
        "clientGuid": "28822E40-EC28-06EB-5AAA-A99F31F6FB1D",
        "loggedUser": "mar.vam",
        "createdDateTime": "2021-09-14 06:09:04"
    },
    {
        "comments": "Health coach daily text reminder sent.",
        "guid": "22BCEB03-6A3B-7EE3-9B81-C20D55D443AA",
        "modifiedDateTime": "2021-08-09 14:00:15",
        "clientGuid": "28822E40-EC28-06EB-5AAA-A99F31F6FB1D",
        "loggedUser": "eri.bro",
        "createdDateTime": "2021-08-09 07:08:15"
    },
    {
        "comments": "Patient called while he was at pcp office and provided today's reading, nurse standing beside him verified readings. 122 bs 138/78/85. manually entered so patient would not have to take a second reading for the day.",
        "guid": "A3DCA85E-4F7F-0467-BBE9-140D65EEFCC4",
        "modifiedDateTime": "2021-09-28 19:37:58",
        "clientGuid": "28822E40-EC28-06EB-5AAA-A99F31F6FB1D",
        "loggedUser": "mar.vam",
        "createdDateTime": "2021-09-29 12:09:58"
    },
    {
        "comments": "Health coach vm left with Pt. regarding her missed readings. I asked for her to return my call asap.",
        "guid": "F74CEBB6-6A0F-3167-6689-41FFA1DBCC91",
        "modifiedDateTime": "2021-08-18 14:29:47",
        "clientGuid": "96E56114-1D35-4FA5-FB9B-A8EAAEC83F20",
        "loggedUser": "eri.bro",
        "createdDateTime": "2021-08-18 07:08:56"
    },
    {
        "comments": "Health Coach daily reminder sent.",
        "guid": "B7F71872-7F7B-1FDA-9295-17D89FEB8F9C",
        "modifiedDateTime": "2021-08-16 14:40:04",
        "clientGuid": "96E56114-1D35-4FA5-FB9B-A8EAAEC83F20",
        "loggedUser": "eri.bro",
        "createdDateTime": "2021-08-16 07:08:04"
    },
    {
        "comments": "Health coach daily reading reminder sent to patient.",
        "guid": "E7A10E8E-707E-45E4-46E1-DAFDC1C2D8F3",
        "modifiedDateTime": "2021-09-21 19:36:00",
        "clientGuid": "96E56114-1D35-4FA5-FB9B-A8EAAEC83F20",
        "loggedUser": "mar.vam",
        "createdDateTime": "2021-09-22 12:09:00"
    },
    {
        "comments": "Health coach daily text reminder sent.",
        "guid": "38D845AD-800C-BBAA-CD8F-5677086F657C",
        "modifiedDateTime": "2021-08-11 18:17:39",
        "clientGuid": "96E56114-1D35-4FA5-FB9B-A8EAAEC83F20",
        "loggedUser": "mar.vam",
        "createdDateTime": "2021-08-11 11:08:39"
    },
    {
        "comments": "Patients device has lost cell signal and I will have to add her to list for a new 4G device. She will send me readings so i can manually input them until a nurse can bring her a new device.",
        "guid": "633E4545-7A74-31F4-91B2-3A0048AAC88D",
        "modifiedDateTime": "2021-07-21 16:58:03",
        "clientGuid": "96E56114-1D35-4FA5-FB9B-A8EAAEC83F20",
        "loggedUser": "eri.bro",
        "createdDateTime": "2021-07-21 09:07:03"
    },
    {
        "comments": "Health coach daily reading reminder sent to patient.",
        "guid": "78BB4B48-EEF9-4293-ECDD-E76AAD3C8DD3",
        "modifiedDateTime": "2021-09-09 17:38:28",
        "clientGuid": "96E56114-1D35-4FA5-FB9B-A8EAAEC83F20",
        "loggedUser": "mar.vam",
        "createdDateTime": "2021-09-09 10:09:28"
    },
    {
        "comments": "Health coach daily text reminder sent.",
        "guid": "B65A4A77-E467-5B2E-7C34-408F7C923C8E",
        "modifiedDateTime": "2021-08-09 16:16:14",
        "clientGuid": "96E56114-1D35-4FA5-FB9B-A8EAAEC83F20",
        "loggedUser": "eri.bro",
        "createdDateTime": "2021-08-09 09:08:14"
    },
    {
        "comments": "Health coach missed reminder sent to patient.",
        "guid": "B22C5D66-2B3B-22BE-FC86-19108AA24855",
        "modifiedDateTime": "2021-09-14 18:40:59",
        "clientGuid": "96E56114-1D35-4FA5-FB9B-A8EAAEC83F20",
        "loggedUser": "mar.vam",
        "createdDateTime": "2021-09-14 11:09:59"
    },
    {
        "comments": "Supplies Sent 9/2/21",
        "guid": "98D3F6DC-940C-C921-EC84-22260A3641FD",
        "modifiedDateTime": "2021-09-02 14:42:40",
        "clientGuid": "46E6EEC5-6A5F-E894-6426-A40BB6682544",
        "loggedUser": "cal.jmo",
        "createdDateTime": "2021-09-02 07:09:40"
    },
    {
        "comments": "Patient stated that she would check her BP when we got off the phone. She did some rearranging and put it out of sight and forgot about checking it.",
        "guid": "E0582104-4CD4-F3AB-7FEE-6C0ABA90129F",
        "modifiedDateTime": "2021-07-27 12:36:05",
        "clientGuid": "8710BC3B-E77E-E557-0304-4BC581D291C6",
        "loggedUser": "eri.bro",
        "createdDateTime": "2021-07-27 05:07:05"
    },
    {
        "comments": "Health coach call made to Pt. regarding the benefits of using this program to his benefit. I left a message and explained that in detail and asked that he return my call so we could discuss options for monitoring his BP & BS.",
        "guid": "F0E842BF-3691-C66A-3655-FE22FA446E09",
        "modifiedDateTime": "2021-07-07 10:34:45",
        "clientGuid": "FE33826B-5B7F-78D3-D433-3778C41DFD03",
        "loggedUser": "eri.bro",
        "createdDateTime": "2021-07-07 03:07:45"
    },
    {
        "comments": "Pt does not respond to my calls or daily text reminders.",
        "guid": "9C270148-7F17-4FBC-F94B-4F9231FDDF43",
        "modifiedDateTime": "2021-05-10 18:01:59",
        "clientGuid": "FE33826B-5B7F-78D3-D433-3778C41DFD03",
        "loggedUser": "eri.bro",
        "createdDateTime": "2021-05-10 11:05:59"
    },
    {
        "comments": "Patient agreed to take his BP 3 days a week. As well as text reminders M, W, F at noon.",
        "guid": "FADEB73F-6A44-9FA9-61A3-041486C2516B",
        "modifiedDateTime": "2021-03-19 12:37:28",
        "clientGuid": "FE33826B-5B7F-78D3-D433-3778C41DFD03",
        "loggedUser": "ter.bmo",
        "createdDateTime": "2021-03-19 05:03:28"
    },
    {
        "comments": "Left the Pt. a vm regarding his compliance and asked for a return call back. This Pt. is non-compliant and very hostile on the phone when I have called to ask for his BP & BS. Pt. does not like being told what to do and does not think he needs this program. He has called us \"Crazy\" and seems to think that this program is about money profiting.",
        "guid": "87B2DF29-CCF8-89C7-E876-D14AB9A7AC60",
        "modifiedDateTime": "2021-05-05 11:33:58",
        "clientGuid": "FE33826B-5B7F-78D3-D433-3778C41DFD03",
        "loggedUser": "eri.bro",
        "createdDateTime": "2021-05-05 04:05:58"
    },
    {
        "comments": "Patient has been discharged for being noncompliant.",
        "guid": "3787FD94-5D3D-BA5A-8DFF-AAB15CF5B045",
        "modifiedDateTime": "2021-09-09 11:59:11",
        "clientGuid": "FE33826B-5B7F-78D3-D433-3778C41DFD03",
        "loggedUser": "mar.vam",
        "createdDateTime": "2021-09-09 04:09:11"
    },
    {
        "comments": "Health Coach called patient, no answer, LVM",
        "guid": "CEB333FC-A700-E6E5-E58B-F8F71DC0D8A1",
        "modifiedDateTime": "2021-09-21 13:55:30",
        "clientGuid": "AF8F69FC-D7A9-D523-D41F-56F756E0EE73",
        "loggedUser": "ed.est",
        "createdDateTime": "2021-09-21 06:09:30"
    },
    {
        "comments": "Patient states she is about to check her BP right now.",
        "guid": "2467D6F7-D041-9F1D-593E-5C2E1CB3BB4B",
        "modifiedDateTime": "2021-08-13 12:53:58",
        "clientGuid": "AF8F69FC-D7A9-D523-D41F-56F756E0EE73",
        "loggedUser": "eri.bro",
        "createdDateTime": "2021-08-13 05:08:58"
    },
    {
        "comments": "Pt. has either turned off phone or switched phone numbers. Unable to reach Pt.",
        "guid": "C1913823-9E29-3381-A90F-3C6C70998113",
        "modifiedDateTime": "2021-03-18 17:02:41",
        "clientGuid": "DF25A6A1-E1F2-FFF2-022E-EEEDC0AA4E6C",
        "loggedUser": "eri.bro",
        "createdDateTime": "2021-03-18 10:03:41"
    },
    {
        "comments": "Diabetic testing supplies sent out today.",
        "guid": "F788ABCA-E593-4F60-7C74-1AFF5472C9B4",
        "modifiedDateTime": "2021-06-02 09:56:52",
        "clientGuid": "46E6EEC5-6A5F-E894-6426-A40BB6682544",
        "loggedUser": "eri.bro",
        "createdDateTime": "2021-06-02 02:06:52"
    },
    {
        "comments": "Health Coach daily reminder sent.",
        "guid": "98E8772E-A768-611A-9621-09EC964453EC",
        "modifiedDateTime": "2021-08-16 14:39:03",
        "clientGuid": "AF8F69FC-D7A9-D523-D41F-56F756E0EE73",
        "loggedUser": "eri.bro",
        "createdDateTime": "2021-08-16 07:08:03"
    },
    {
        "comments": "Health Coach, spoke to patient, states she is currently in the process of moving, provided new address 9004 Brian Way Cir #204, Ft. Worth, Tx 76116.  Patient states she will provide a reading this afternoon.",
        "guid": "4BE65986-A595-BDAC-3F79-DC716D1FAB25",
        "modifiedDateTime": "2021-08-11 14:02:09",
        "clientGuid": "AF8F69FC-D7A9-D523-D41F-56F756E0EE73",
        "loggedUser": "mar.vam",
        "createdDateTime": "2021-08-11 07:08:09"
    },
    {
        "comments": "Health coach daily text reminder was sent.",
        "guid": "7A085759-FF82-DAE6-992B-5B64513221F8",
        "modifiedDateTime": "2021-08-11 18:15:35",
        "clientGuid": "C12FDA5F-DD89-0E9B-D4B4-895790A35E7F",
        "loggedUser": "eri.bro",
        "createdDateTime": "2021-08-11 11:08:35"
    },
    {
        "comments": "Health Coach called patient, patient did not answer, LVM, sent message",
        "guid": "466ECEF8-56D0-24E3-48AF-C25D68EB94A3",
        "modifiedDateTime": "2021-09-22 18:08:39",
        "clientGuid": "59B40EB0-67E7-D153-28B0-C5CA92FFCD1B",
        "loggedUser": "ed.est",
        "createdDateTime": "2021-09-22 11:09:39"
    },
    {
        "comments": "Health Coach called patient, no answer, LVM",
        "guid": "333E79D9-B89A-3A74-B2EC-B2AC7E221303",
        "modifiedDateTime": "2021-09-29 14:17:57",
        "clientGuid": "AF8F69FC-D7A9-D523-D41F-56F756E0EE73",
        "loggedUser": "ed.est",
        "createdDateTime": "2021-09-29 07:09:57"
    },
    {
        "comments": "Supplies Sent 7/15/21",
        "guid": "565C2BAA-C482-4094-1B33-B3E88013393D",
        "modifiedDateTime": "2021-07-15 13:44:17",
        "clientGuid": "058DBB80-1920-6BEB-CFB9-95C4ED5CF79F",
        "loggedUser": "cal.jmo",
        "createdDateTime": "2021-07-15 06:07:17"
    },
    {
        "comments": "Diabetic testing supplies being sent out today.",
        "guid": "ECC3C16B-11A2-682A-92E3-B9D01AEFE14B",
        "modifiedDateTime": "2021-05-12 10:55:23",
        "clientGuid": "058DBB80-1920-6BEB-CFB9-95C4ED5CF79F",
        "loggedUser": "eri.bro",
        "createdDateTime": "2021-05-12 03:05:23"
    },
    {
        "comments": "Health Coach daily reminder sent to patient.",
        "guid": "EBBE2728-9635-03C5-CCEB-B7AF4A2BF81F",
        "modifiedDateTime": "2021-09-17 18:20:20",
        "clientGuid": "AF8F69FC-D7A9-D523-D41F-56F756E0EE73",
        "loggedUser": "mar.vam",
        "createdDateTime": "2021-09-17 11:09:20"
    },
    {
        "comments": "Health Coach sent missed reading reminder.",
        "guid": "9EABBEA1-B778-7E3E-1409-834A3F15DC02",
        "modifiedDateTime": "2021-09-15 18:56:10",
        "clientGuid": "AF8F69FC-D7A9-D523-D41F-56F756E0EE73",
        "loggedUser": "mar.vam",
        "createdDateTime": "2021-09-15 11:09:10"
    },
    {
        "comments": "Health Coach daily reminder sent to patient.",
        "guid": "EF5ACA54-351D-003D-54FA-41CB60F81F9E",
        "modifiedDateTime": "2021-09-17 18:20:38",
        "clientGuid": "59B40EB0-67E7-D153-28B0-C5CA92FFCD1B",
        "loggedUser": "mar.vam",
        "createdDateTime": "2021-09-17 11:09:38"
    },
    {
        "comments": "Health Coach Daily Reminder Sent To Patient.",
        "guid": "CDDABC8F-1B2E-3814-99E7-7227B16CA482",
        "modifiedDateTime": "2021-09-13 18:43:00",
        "clientGuid": "AF8F69FC-D7A9-D523-D41F-56F756E0EE73",
        "loggedUser": "mar.vam",
        "createdDateTime": "2021-09-13 11:09:00"
    },
    {
        "comments": "Health coach daily reading reminder sent to patient.",
        "guid": "A2B2DE46-5DE7-3A64-7AAB-50482A80C344",
        "modifiedDateTime": "2021-09-09 17:38:35",
        "clientGuid": "AF8F69FC-D7A9-D523-D41F-56F756E0EE73",
        "loggedUser": "mar.vam",
        "createdDateTime": "2021-09-09 10:09:35"
    },
    {
        "comments": "Health Coach daily reminder sent to patient.",
        "guid": "E378C7CA-53F9-195E-3874-DE32714A38FA",
        "modifiedDateTime": "2021-09-30 15:10:19",
        "clientGuid": "AF8F69FC-D7A9-D523-D41F-56F756E0EE73",
        "loggedUser": "ed.est",
        "createdDateTime": "2021-09-30 08:09:19"
    },
    {
        "comments": "Supplies Sent 8/18/21",
        "guid": "7E228345-CA57-DF5A-B85D-D7233336BFCB",
        "modifiedDateTime": "2021-08-18 14:30:13",
        "clientGuid": "72E185EE-4932-96C3-A92D-274EC957B7FB",
        "loggedUser": "cal.jmo",
        "createdDateTime": "2021-08-18 07:08:13"
    },
    {
        "comments": "Health coach daily text reminder sent.",
        "guid": "59933A0F-09BB-E6C5-5529-4B3EF7B94C7E",
        "modifiedDateTime": "2021-08-11 18:17:46",
        "clientGuid": "72E185EE-4932-96C3-A92D-274EC957B7FB",
        "loggedUser": "mar.vam",
        "createdDateTime": "2021-08-11 11:08:46"
    },
    {
        "comments": "Health Coach missed reading reminder sent to patient.",
        "guid": "25B72090-D379-908A-47D3-54ACF53B7BE4",
        "modifiedDateTime": "2021-09-14 17:26:14",
        "clientGuid": "72E185EE-4932-96C3-A92D-274EC957B7FB",
        "loggedUser": "mar.vam",
        "createdDateTime": "2021-09-14 10:09:14"
    },
    {
        "comments": "Health Coach daily reminder sent.",
        "guid": "E6455B1F-8313-9157-D227-76B4BBCFEBFC",
        "modifiedDateTime": "2021-08-16 14:38:51",
        "clientGuid": "72E185EE-4932-96C3-A92D-274EC957B7FB",
        "loggedUser": "eri.bro",
        "createdDateTime": "2021-08-16 07:08:51"
    },
    {
        "comments": "Health coach daily reading reminder sent to patient.",
        "guid": "BF9FBDBF-F3A1-7239-B9FA-3989B9B9F352",
        "modifiedDateTime": "2021-09-21 19:47:38",
        "clientGuid": "72E185EE-4932-96C3-A92D-274EC957B7FB",
        "loggedUser": "mar.vam",
        "createdDateTime": "2021-09-22 12:09:38"
    },
    {
        "comments": "Supplies Sent 7/21/21",
        "guid": "C4BC78B4-1F4F-B566-729B-65C54F53247A",
        "modifiedDateTime": "2021-07-21 12:47:32",
        "clientGuid": "72E185EE-4932-96C3-A92D-274EC957B7FB",
        "loggedUser": "cal.jmo",
        "createdDateTime": "2021-07-21 05:07:32"
    },
    {
        "comments": "Pt. stated she would take vitals when she returns home from doctors.",
        "guid": "762D8752-89A1-830A-A424-A9A3BE8E47D1",
        "modifiedDateTime": "2021-04-02 15:52:41",
        "clientGuid": "72E185EE-4932-96C3-A92D-274EC957B7FB",
        "loggedUser": "eri.bro",
        "createdDateTime": "2021-04-02 08:04:41"
    },
    {
        "comments": "Pt. stated she would check BP & BS today and she needed diabetic testing supplies sent out this month. I sent email for delivery, address confirmed.",
        "guid": "10F3739A-3384-1EF6-81E3-A4CD388C5ED0",
        "modifiedDateTime": "2021-08-18 14:29:28",
        "clientGuid": "72E185EE-4932-96C3-A92D-274EC957B7FB",
        "loggedUser": "eri.bro",
        "createdDateTime": "2021-08-18 07:08:28"
    },
    {
        "comments": "Health coach daily reading reminder sent to patient.",
        "guid": "CA636EF7-56F0-AA59-8ECB-B562EB664705",
        "modifiedDateTime": "2021-09-09 17:38:42",
        "clientGuid": "72E185EE-4932-96C3-A92D-274EC957B7FB",
        "loggedUser": "mar.vam",
        "createdDateTime": "2021-09-09 10:09:42"
    },
    {
        "comments": "Health coach daily text reminder sent.",
        "guid": "51F89DCE-9504-4BAC-6998-7E8F9DDDBEAD",
        "modifiedDateTime": "2021-08-09 14:13:12",
        "clientGuid": "72E185EE-4932-96C3-A92D-274EC957B7FB",
        "loggedUser": "eri.bro",
        "createdDateTime": "2021-08-09 07:08:12"
    },
    {
        "comments": "Supplies Sent 9/23/21",
        "guid": "229CC337-A6F3-A6D8-C523-3F111D5DCFA8",
        "modifiedDateTime": "2021-09-23 10:37:28",
        "clientGuid": "058DBB80-1920-6BEB-CFB9-95C4ED5CF79F",
        "loggedUser": "cal.jmo",
        "createdDateTime": "2021-09-23 03:09:28"
    },
    {
        "comments": "Health Coach daily reminder sent to patient.",
        "guid": "EE1078E1-B6BA-3F5B-587D-FA2DBD964806",
        "modifiedDateTime": "2021-09-17 18:20:26",
        "clientGuid": "058DBB80-1920-6BEB-CFB9-95C4ED5CF79F",
        "loggedUser": "mar.vam",
        "createdDateTime": "2021-09-17 11:09:26"
    },
    {
        "comments": "Left Patient a vm asking him to check both his BP & BS today.",
        "guid": "FC4DF053-9210-361F-AFD6-9F4E30DF2906",
        "modifiedDateTime": "2021-07-16 11:43:19",
        "clientGuid": "058DBB80-1920-6BEB-CFB9-95C4ED5CF79F",
        "loggedUser": "eri.bro",
        "createdDateTime": "2021-07-16 04:07:19"
    },
    {
        "comments": "Wellness/compliance visit made to patientâ€™s home. The business card I left on his door last week is still there. I went by a second address on Cleveland Street in Cleburne. Left business card there as well Because no one answered the door.",
        "guid": "F3C4524B-C8EB-2AFA-BADA-8F3DF676B6F8",
        "modifiedDateTime": "2021-03-19 10:57:24",
        "clientGuid": "DF25A6A1-E1F2-FFF2-022E-EEEDC0AA4E6C",
        "loggedUser": "cor",
        "createdDateTime": "2021-03-19 03:03:24"
    },
    {
        "comments": "Wellness/compliance visit made to patientâ€™s home today. No one answered the door. I left my business card and a note to call me on Patientâ€™s door.",
        "guid": "E1817C7A-DB59-66FE-6128-73EE6ABFAE92",
        "modifiedDateTime": "2021-03-12 14:52:39",
        "clientGuid": "DF25A6A1-E1F2-FFF2-022E-EEEDC0AA4E6C",
        "loggedUser": "cor",
        "createdDateTime": "2021-03-12 08:03:39"
    },
    {
        "comments": "Health Coach daily reading reminder sent to patient.",
        "guid": "15C1A81D-E52F-03A6-2CC6-CD977DE5CD75",
        "modifiedDateTime": "2021-09-09 16:20:39",
        "clientGuid": "A5DB6C20-4454-FE0B-D3F1-77E9C4920050",
        "loggedUser": "mar.vam",
        "createdDateTime": "2021-09-09 09:09:39"
    },
    {
        "comments": "Health coach daily text reminder sent.",
        "guid": "53809027-699F-EBFF-509D-97476B8ADCB7",
        "modifiedDateTime": "2021-08-09 14:28:20",
        "clientGuid": "46E6EEC5-6A5F-E894-6426-A40BB6682544",
        "loggedUser": "eri.bro",
        "createdDateTime": "2021-08-09 07:08:20"
    },
    {
        "comments": "Supplies Sent 8/26/21",
        "guid": "F3A5AAC4-36EE-7945-66DB-6DA473C24269",
        "modifiedDateTime": "2021-08-26 13:18:11",
        "clientGuid": "A5DB6C20-4454-FE0B-D3F1-77E9C4920050",
        "loggedUser": "cal.jmo",
        "createdDateTime": "2021-08-26 06:08:11"
    },
    {
        "comments": "Patient is out of town and did not take her device.",
        "guid": "23C79C55-0D57-28DD-7E6E-09A3C95863D0",
        "modifiedDateTime": "2021-08-04 13:51:41",
        "clientGuid": "46E6EEC5-6A5F-E894-6426-A40BB6682544",
        "loggedUser": "eri.bro",
        "createdDateTime": "2021-08-04 06:08:41"
    },
    {
        "comments": "Health coach daily reading reminder sent to patient.",
        "guid": "CD4C4670-F75A-1738-4E6A-337C0ED84CD7",
        "modifiedDateTime": "2021-09-21 19:47:46",
        "clientGuid": "A5DB6C20-4454-FE0B-D3F1-77E9C4920050",
        "loggedUser": "mar.vam",
        "createdDateTime": "2021-09-22 12:09:46"
    },
    {
        "comments": "I sent a text to Pt. asking how can I help the patient. I stated that there is not enough activity from Pt. to get the benefits from the program and asked if they wanted to remain on program or be discharged. The lack of effort & non response leads me to question if they are a good fit for the monitoring program.",
        "guid": "6D623CC5-C128-4D3C-2C4A-EED04A17B652",
        "modifiedDateTime": "2021-05-13 14:02:47",
        "clientGuid": "C12FDA5F-DD89-0E9B-D4B4-895790A35E7F",
        "loggedUser": "eri.bro",
        "createdDateTime": "2021-05-13 07:05:47"
    },
    {
        "comments": "call placed to pts daughter to discuss improved compliance and participation with the program.  left VM.",
        "guid": "5E846026-2EAC-14F8-CF7F-73D68248FA8B",
        "modifiedDateTime": "2020-04-13 08:57:49",
        "clientGuid": "C12FDA5F-DD89-0E9B-D4B4-895790A35E7F",
        "loggedUser": "cor",
        "createdDateTime": "2020-04-13 01:04:49"
    },
    {
        "comments": "Health Coach Director, spoke with Sandra at MD office, states ok to dc.  will schedule a time for patient care coordinator to retrieve the monitor.",
        "guid": "36EBD080-85B0-A681-06DA-AC3B8BEAF2C4",
        "modifiedDateTime": "2021-09-13 12:19:06",
        "clientGuid": "C12FDA5F-DD89-0E9B-D4B4-895790A35E7F",
        "loggedUser": "mar.vam",
        "createdDateTime": "2021-09-13 05:09:06"
    },
    {
        "comments": "Health coach daily text reminder was sent.",
        "guid": "197CC295-7B50-6709-0E57-137E110A84D1",
        "modifiedDateTime": "2021-08-10 12:24:58",
        "clientGuid": "C12FDA5F-DD89-0E9B-D4B4-895790A35E7F",
        "loggedUser": "eri.bro",
        "createdDateTime": "2021-08-10 05:08:58"
    },
    {
        "comments": "Pt. caregiver said she would check Pt. Bp tonight when she goes to put her to bed. I have had many conversations with Pt. caregiver concerning Pt. compliance but she seems to be burdened with my phone calls. I will continue to send reminders and calls.",
        "guid": "53C66B2F-C931-9C25-10C2-F99817626BEC",
        "modifiedDateTime": "2021-05-10 17:26:01",
        "clientGuid": "C12FDA5F-DD89-0E9B-D4B4-895790A35E7F",
        "loggedUser": "eri.bro",
        "createdDateTime": "2021-05-10 10:05:01"
    },
    {
        "comments": "Health coach text reminder sent.",
        "guid": "130265C4-6653-9496-1176-37B12C6DBC35",
        "modifiedDateTime": "2021-08-13 12:30:00",
        "clientGuid": "C12FDA5F-DD89-0E9B-D4B4-895790A35E7F",
        "loggedUser": "eri.bro",
        "createdDateTime": "2021-08-13 05:08:00"
    },
    {
        "comments": "Pt. caregiver states she can not force the Pt. to check her BP. She explained that the Pt. does not understand the benefits to taking Bp. Pt. has dementia and views BP checks as a fearful activity..",
        "guid": "0C6DA1B9-3DCD-7B6D-65C4-3DA5465F5555",
        "modifiedDateTime": "2021-05-26 12:20:18",
        "clientGuid": "C12FDA5F-DD89-0E9B-D4B4-895790A35E7F",
        "loggedUser": "eri.bro",
        "createdDateTime": "2021-05-26 05:05:18"
    },
    {
        "comments": "Spoke with Pt. daughter and she wants a call back at 2pm to discuss her mothers compliance.",
        "guid": "AB8F4DD1-8A64-C758-48DD-B8BB3E5D0BBC",
        "modifiedDateTime": "2021-02-23 12:32:41",
        "clientGuid": "C12FDA5F-DD89-0E9B-D4B4-895790A35E7F",
        "loggedUser": "eri.bro",
        "createdDateTime": "2021-02-23 06:02:41"
    },
    {
        "comments": "Health coach, spoke with daughter, clarified with dghtr, patient is not in a group home, dghtr pays for the caregiver and can not afford to pay for extra task for the caregiver to take readings.   States wants to discharge from program unless provider authorizes home health to come and help.  MD has been notified.",
        "guid": "989A2AD8-F4B3-16EC-9879-C71E9D25A784",
        "modifiedDateTime": "2021-09-10 12:21:05",
        "clientGuid": "C12FDA5F-DD89-0E9B-D4B4-895790A35E7F",
        "loggedUser": "mar.vam",
        "createdDateTime": "2021-09-10 05:09:05"
    },
    {
        "comments": "Health Coach daily reminder sent.",
        "guid": "67B84DE5-014F-6810-7898-3D60CD9EFF0E",
        "modifiedDateTime": "2021-08-16 12:24:12",
        "clientGuid": "C12FDA5F-DD89-0E9B-D4B4-895790A35E7F",
        "loggedUser": "eri.bro",
        "createdDateTime": "2021-08-16 05:08:12"
    },
    {
        "comments": "wellness call made to patient to encourage better compliance with the program.  Its been 5 days since they have checked BP/BS",
        "guid": "05B1396C-2A38-DB45-0C42-57B06E1AA262",
        "modifiedDateTime": "2020-03-02 08:07:09",
        "clientGuid": "C12FDA5F-DD89-0E9B-D4B4-895790A35E7F",
        "loggedUser": "cor",
        "createdDateTime": "2020-03-02 02:03:09"
    },
    {
        "comments": "Left a vm about Pt. compliance urging the caregiver to get vitals taken at least 2X a week. Asked for a return call and informed them to charge the device for 3-5 hours. I also text this Pt on a regular with text reminders to check vitals.",
        "guid": "2FE0FE57-EEB7-3790-3574-66050DFA4E60",
        "modifiedDateTime": "2021-04-20 14:59:48",
        "clientGuid": "C12FDA5F-DD89-0E9B-D4B4-895790A35E7F",
        "loggedUser": "eri.bro",
        "createdDateTime": "2021-04-20 07:04:06"
    },
    {
        "comments": "Health Coach Director, called patient, no answer, lvm, and sent message. Will continue to f/u",
        "guid": "4402519B-A587-523E-A889-0C8DC44FEACA",
        "modifiedDateTime": "2021-09-03 17:29:50",
        "clientGuid": "C12FDA5F-DD89-0E9B-D4B4-895790A35E7F",
        "loggedUser": "mar.vam",
        "createdDateTime": "2021-09-03 10:09:50"
    },
    {
        "comments": "spoke with staff where patient resides about the importance of checking BP and BS consistently.",
        "guid": "58395FE4-289E-EE69-71AB-B473E757D22B",
        "modifiedDateTime": "2020-06-08 11:07:54",
        "clientGuid": "C12FDA5F-DD89-0E9B-D4B4-895790A35E7F",
        "loggedUser": "cor",
        "createdDateTime": "2020-06-08 04:06:54"
    },
    {
        "comments": "Health coach text reminder sent.",
        "guid": "7120B1C9-C33E-7F2E-0E08-B15D2787D356",
        "modifiedDateTime": "2021-09-07 10:40:12",
        "clientGuid": "C12FDA5F-DD89-0E9B-D4B4-895790A35E7F",
        "loggedUser": "eri.bro",
        "createdDateTime": "2021-09-07 03:09:12"
    },
    {
        "comments": "Pt. informed me that she is being released from the hospital today and she will start back at checking vitals and glucose tomorrow morning.",
        "guid": "4A5257B9-66C3-49EF-7D74-7478EA18D832",
        "modifiedDateTime": "2021-08-16 13:22:52",
        "clientGuid": "B3822055-C056-73C2-FD5E-74AEC204EE77",
        "loggedUser": "eri.bro",
        "createdDateTime": "2021-08-16 06:08:52"
    },
    {
        "comments": "Supplies Sent 8/30/21",
        "guid": "3176026D-887D-911B-9AA0-4F4E3A433206",
        "modifiedDateTime": "2021-08-30 15:19:21",
        "clientGuid": "B3822055-C056-73C2-FD5E-74AEC204EE77",
        "loggedUser": "cal.jmo",
        "createdDateTime": "2021-08-30 08:08:21"
    },
    {
        "comments": "Health coach daily text reminder sent.",
        "guid": "820C350E-1A07-AA7B-2B66-98AE5298C9F1",
        "modifiedDateTime": "2021-08-09 16:52:11",
        "clientGuid": "B3822055-C056-73C2-FD5E-74AEC204EE77",
        "loggedUser": "eri.bro",
        "createdDateTime": "2021-08-09 09:08:11"
    },
    {
        "comments": "Unsuccessful at reaching patient, left vm for a return call.",
        "guid": "385FF8E9-A950-22DE-C803-0607FBA35965",
        "modifiedDateTime": "2021-08-03 12:01:30",
        "clientGuid": "C44E9675-8952-12C9-8669-5FF145FBB48F",
        "loggedUser": "eri.bro",
        "createdDateTime": "2021-08-03 05:08:30"
    },
    {
        "comments": "Health coach message left for Pt. regarding her compliance. I asked that she return my call so we can discuss options for checking vitals consistently.",
        "guid": "6A701188-D8FA-EF93-1F8E-CB929AB3BA23",
        "modifiedDateTime": "2021-07-27 10:30:21",
        "clientGuid": "C44E9675-8952-12C9-8669-5FF145FBB48F",
        "loggedUser": "eri.bro",
        "createdDateTime": "2021-07-27 03:07:21"
    },
    {
        "comments": "Supplies Sent 7/27/21",
        "guid": "F5302733-CF78-7F96-8E40-58C1564A61A5",
        "modifiedDateTime": "2021-07-27 13:34:17",
        "clientGuid": "8E347ADC-B057-B7BA-B13B-914824036C97",
        "loggedUser": "cal.jmo",
        "createdDateTime": "2021-07-27 06:07:17"
    },
    {
        "comments": "Pt. was released from hospital this morning. Pt. stated he would charge device and start taking readings regularly.",
        "guid": "8827E775-8B5D-3E04-1EE0-45E46D34190B",
        "modifiedDateTime": "2021-02-12 14:41:35",
        "clientGuid": "5080A364-8478-033C-2AF0-572FA5148019",
        "loggedUser": "eri.bro",
        "createdDateTime": "2021-02-12 08:02:35"
    },
    {
        "comments": "Supplies Sent 9/27/21",
        "guid": "877CBA81-4A7A-EA2B-57B8-3CEAEC200997",
        "modifiedDateTime": "2021-09-27 10:33:21",
        "clientGuid": "8E347ADC-B057-B7BA-B13B-914824036C97",
        "loggedUser": "cal.jmo",
        "createdDateTime": "2021-09-27 03:09:21"
    },
    {
        "comments": "Health coach daily text reminder sent to check BS.",
        "guid": "4DBEC542-2AAB-B417-138E-DCCA9117F5FA",
        "modifiedDateTime": "2021-08-09 10:12:39",
        "clientGuid": "5DB91098-163A-A7E6-A2BC-BE7FF2049765",
        "loggedUser": "eri.bro",
        "createdDateTime": "2021-08-09 03:08:39"
    },
    {
        "comments": "Health Coach daily reading reminder sent to patient.",
        "guid": "1B97DA52-CD7C-FCCF-22C7-20380E7F517F",
        "modifiedDateTime": "2021-09-09 16:21:06",
        "clientGuid": "D5135C9E-10CF-E8DF-C69E-5159D2CE6FEA",
        "loggedUser": "mar.vam",
        "createdDateTime": "2021-09-09 09:09:06"
    },
    {
        "comments": "Health Coach daily reading reminder sent to patient.",
        "guid": "65DC6F70-4DF8-7809-DB6F-14B5CA787461",
        "modifiedDateTime": "2021-09-09 16:20:45",
        "clientGuid": "8E347ADC-B057-B7BA-B13B-914824036C97",
        "loggedUser": "mar.vam",
        "createdDateTime": "2021-09-09 09:09:45"
    },
    {
        "comments": "Attempted to call Pt. regarding compliance but voice mailbox was full and could not leave a message. I send daily text reminders but do not get a response.",
        "guid": "7E9795A6-0651-00DE-0E6E-4A72CE012D51",
        "modifiedDateTime": "2021-05-04 14:24:45",
        "clientGuid": "5080A364-8478-033C-2AF0-572FA5148019",
        "loggedUser": "eri.bro",
        "createdDateTime": "2021-05-04 07:05:45"
    },
    {
        "comments": "Pt. ordered diabetic testing supplies-Mailed 4-1-21",
        "guid": "0054DB2E-BCC9-56F3-082D-61338ECE08D1",
        "modifiedDateTime": "2021-04-01 15:03:26",
        "clientGuid": "5080A364-8478-033C-2AF0-572FA5148019",
        "loggedUser": "eri.bro",
        "createdDateTime": "2021-04-01 08:04:26"
    },
    {
        "comments": "Health Coach called patient, patient was out of town for the week, patient has returned and will continue with daily readings",
        "guid": "EB346CD2-A918-3F4E-F89B-A7F1DDBBE26F",
        "modifiedDateTime": "2021-09-27 17:05:44",
        "clientGuid": "59B40EB0-67E7-D153-28B0-C5CA92FFCD1B",
        "loggedUser": "ed.est",
        "createdDateTime": "2021-09-27 10:09:44"
    },
    {
        "comments": "Health Coach sent a reminder to patient",
        "guid": "2B36B796-5121-1224-FEBA-1BC05883933F",
        "modifiedDateTime": "2021-09-08 17:22:11",
        "clientGuid": "59B40EB0-67E7-D153-28B0-C5CA92FFCD1B",
        "loggedUser": "ed.est",
        "createdDateTime": "2021-09-08 10:09:11"
    },
    {
        "comments": "Health coach sent reminder to patient",
        "guid": "DD6DF87B-CBE6-EA8B-23D9-DCD93A028B8D",
        "modifiedDateTime": "2021-09-15 17:26:36",
        "clientGuid": "59B40EB0-67E7-D153-28B0-C5CA92FFCD1B",
        "loggedUser": "ed.est",
        "createdDateTime": "2021-09-15 10:09:36"
    },
    {
        "comments": "Supplies Sent 9/22/21",
        "guid": "E267579D-4299-0986-BFBA-EF607B50A9E5",
        "modifiedDateTime": "2021-09-22 10:22:22",
        "clientGuid": "13D1DE89-3CBD-769B-88AF-3A72394D5FEB",
        "loggedUser": "cal.jmo",
        "createdDateTime": "2021-09-22 03:09:22"
    },
    {
        "comments": "Diabetic testing supplies being sent today. Pt. informed me that she is having a biopsy tomorrow at 7;30am.",
        "guid": "F2D19C61-D0AA-C438-D74C-75F5856B5C5D",
        "modifiedDateTime": "2021-04-22 10:37:18",
        "clientGuid": "A5DB6C20-4454-FE0B-D3F1-77E9C4920050",
        "loggedUser": "eri.bro",
        "createdDateTime": "2021-04-22 03:04:18"
    },
    {
        "comments": "Health Coach Director, daily reminder sent to patient.",
        "guid": "A123C49D-94D1-8917-21B0-B7FC1D5D03D2",
        "modifiedDateTime": "2021-09-10 19:53:00",
        "clientGuid": "A5DB6C20-4454-FE0B-D3F1-77E9C4920050",
        "loggedUser": "mar.vam",
        "createdDateTime": "2021-09-11 12:09:00"
    },
    {
        "comments": "Patient was not home...",
        "guid": "AD9BB5D3-FFB7-CE70-5F48-CA14B042BEDA",
        "modifiedDateTime": "2021-04-26 10:10:15",
        "clientGuid": "B37E39C2-86BE-4947-0AA8-4D31D98651AF",
        "loggedUser": "ter.bmo",
        "createdDateTime": "2021-04-26 03:04:15"
    },
    {
        "comments": "Patient notified me that he was in the hospital and will let me know when he gets out. Thank you",
        "guid": "2CA8E89E-2026-0638-C559-0F77E18850B5",
        "modifiedDateTime": "2020-11-17 12:19:09",
        "clientGuid": "B37E39C2-86BE-4947-0AA8-4D31D98651AF",
        "loggedUser": "cor",
        "createdDateTime": "2020-11-17 06:11:09"
    },
    {
        "comments": "Went by patientâ€™s home. A friend informed me that patient remains in the hospital in Dallas.",
        "guid": "8328FDDA-52FC-71E3-A42A-D9DB757C3AE6",
        "modifiedDateTime": "2021-01-19 11:20:26",
        "clientGuid": "B37E39C2-86BE-4947-0AA8-4D31D98651AF",
        "loggedUser": "cor",
        "createdDateTime": "2021-01-19 05:01:26"
    },
    {
        "comments": "Wellness/coaching call made to pt.  Left VM for him to call me back.",
        "guid": "E682219A-EFFC-5FD9-3200-FD1C4497947B",
        "modifiedDateTime": "2020-09-01 10:14:11",
        "clientGuid": "B37E39C2-86BE-4947-0AA8-4D31D98651AF",
        "loggedUser": "cor",
        "createdDateTime": "2020-09-01 03:09:11"
    },
    {
        "comments": "Wellness/compliance visit made to patientâ€™s home today. No answer. Left my business card and a note on patient door for him to call me. Most likely need to proceed with discharge of patient. Thank you",
        "guid": "AAB8AD80-CE57-FC74-09D4-70CA9AD370A9",
        "modifiedDateTime": "2021-04-27 10:12:47",
        "clientGuid": "B37E39C2-86BE-4947-0AA8-4D31D98651AF",
        "loggedUser": "cor",
        "createdDateTime": "2021-04-27 03:04:10"
    },
    {
        "comments": "Health Coach daily reminder sent.",
        "guid": "457EFE6C-D427-0883-9ABB-D1065FFCBCBD",
        "modifiedDateTime": "2021-08-16 13:39:07",
        "clientGuid": "A5DB6C20-4454-FE0B-D3F1-77E9C4920050",
        "loggedUser": "eri.bro",
        "createdDateTime": "2021-08-16 06:08:07"
    },
    {
        "comments": "New 4G Device Sent 9/30/21\nID:479E",
        "guid": "EE48FE84-BF06-86DF-6E8C-B779AD5CBD9E",
        "modifiedDateTime": "2021-09-30 11:23:04",
        "clientGuid": "A5DB6C20-4454-FE0B-D3F1-77E9C4920050",
        "loggedUser": "cal.jmo",
        "createdDateTime": "2021-09-30 04:09:42"
    },
    {
        "comments": "Patient sent daily reading while waiting for new monitor.  bp 134/98/89",
        "guid": "34CD16B5-D6FB-0B65-E510-E61C5B663F5E",
        "modifiedDateTime": "2021-10-01 09:28:38",
        "clientGuid": "A5DB6C20-4454-FE0B-D3F1-77E9C4920050",
        "loggedUser": "mar.vam",
        "createdDateTime": "2021-10-01 02:10:38"
    },
    {
        "comments": "Patient verified address for new monitor and agreed to return old monitor.",
        "guid": "9BB5BF3D-220C-B7D7-B3F7-A0E1D508B389",
        "modifiedDateTime": "2021-09-30 08:51:00",
        "clientGuid": "A5DB6C20-4454-FE0B-D3F1-77E9C4920050",
        "loggedUser": "mar.vam",
        "createdDateTime": "2021-09-30 01:09:00"
    },
    {
        "comments": "Wellness call made to Pt regarding missed readings",
        "guid": "87527CAA-0284-164B-C2B4-5846587981E4",
        "modifiedDateTime": "2021-08-26 11:37:38",
        "clientGuid": "A5DB6C20-4454-FE0B-D3F1-77E9C4920050",
        "loggedUser": "eri.bro",
        "createdDateTime": "2021-08-26 04:08:38"
    },
    {
        "comments": "Pt, is in hospital having a hysterotomy.",
        "guid": "FC25F797-F7A8-DE89-B926-17F770476C59",
        "modifiedDateTime": "2021-05-21 14:13:20",
        "clientGuid": "A5DB6C20-4454-FE0B-D3F1-77E9C4920050",
        "loggedUser": "eri.bro",
        "createdDateTime": "2021-05-21 07:05:51"
    },
    {
        "comments": "I called asking Pt. to check her daily readings that she had missed 4 days and she stated verbally she would go check them right now and she did need diabetic supplies mailed out to her, address was corrected in system and sent email for delivery.",
        "guid": "6321A269-EB37-2535-D5EC-0AF0AEDE30A9",
        "modifiedDateTime": "2021-08-26 11:41:01",
        "clientGuid": "A5DB6C20-4454-FE0B-D3F1-77E9C4920050",
        "loggedUser": "eri.bro",
        "createdDateTime": "2021-08-26 04:08:01"
    },
    {
        "comments": "Supplies Resent 9/2/21",
        "guid": "CAB84ACB-EFC1-FBCF-052F-F11BB2158EA7",
        "modifiedDateTime": "2021-09-02 14:55:10",
        "clientGuid": "A5DB6C20-4454-FE0B-D3F1-77E9C4920050",
        "loggedUser": "cal.jmo",
        "createdDateTime": "2021-09-02 07:09:10"
    },
    {
        "comments": "Health coach daily reminder sent to patient.",
        "guid": "7AEF2DE8-515A-A9C4-5332-D4A36AAFAF05",
        "modifiedDateTime": "2021-09-15 18:20:20",
        "clientGuid": "59B40EB0-67E7-D153-28B0-C5CA92FFCD1B",
        "loggedUser": "mar.vam",
        "createdDateTime": "2021-09-15 11:09:20"
    },
    {
        "comments": "Health Coach sent daily reminder",
        "guid": "0FEA4949-7863-1803-7F6E-997768EA2F76",
        "modifiedDateTime": "2021-08-12 17:21:29",
        "clientGuid": "59B40EB0-67E7-D153-28B0-C5CA92FFCD1B",
        "loggedUser": "ed.est",
        "createdDateTime": "2021-08-12 10:08:29"
    },
    {
        "comments": "Health Coach called patient, patient states she will get a reading done today",
        "guid": "A8B2A02F-AB90-CA79-B520-7F4407FFE420",
        "modifiedDateTime": "2021-09-10 17:26:24",
        "clientGuid": "59B40EB0-67E7-D153-28B0-C5CA92FFCD1B",
        "loggedUser": "ed.est",
        "createdDateTime": "2021-09-10 10:09:24"
    },
    {
        "comments": "Health coach daily text reminder sent.",
        "guid": "95859967-7CFA-6280-7140-170FEC6028C3",
        "modifiedDateTime": "2021-08-11 18:17:53",
        "clientGuid": "59B40EB0-67E7-D153-28B0-C5CA92FFCD1B",
        "loggedUser": "mar.vam",
        "createdDateTime": "2021-08-11 11:08:53"
    },
    {
        "comments": "Pt. informed me she is out of town to Puerto Rico until further notice.",
        "guid": "814924B5-B3C9-E8D6-B1B0-775142ACAF10",
        "modifiedDateTime": "2021-04-22 09:24:47",
        "clientGuid": "F70C8D87-E86F-61AC-7C52-46F2723D1693",
        "loggedUser": "eri.bro",
        "createdDateTime": "2021-04-22 02:04:47"
    },
    {
        "comments": "Health Coach Director, daily reminder sent to patient.",
        "guid": "B4FD7021-91B1-5172-1A12-A3BD0570EFAD",
        "modifiedDateTime": "2021-09-10 19:32:56",
        "clientGuid": "59B40EB0-67E7-D153-28B0-C5CA92FFCD1B",
        "loggedUser": "mar.vam",
        "createdDateTime": "2021-09-11 12:09:56"
    },
    {
        "comments": "Health Coach sent reminder to patient",
        "guid": "3D97D128-E20D-1F0C-DB19-809316C83510",
        "modifiedDateTime": "2021-09-17 16:31:28",
        "clientGuid": "59B40EB0-67E7-D153-28B0-C5CA92FFCD1B",
        "loggedUser": "ed.est",
        "createdDateTime": "2021-09-17 09:09:28"
    },
    {
        "comments": "Health Coach sent reminder to patient",
        "guid": "5185A70C-A9C2-A241-1B99-8C2D10511AE2",
        "modifiedDateTime": "2021-09-09 18:32:59",
        "clientGuid": "59B40EB0-67E7-D153-28B0-C5CA92FFCD1B",
        "loggedUser": "ed.est",
        "createdDateTime": "2021-09-09 11:09:59"
    },
    {
        "comments": "Health coach sent out reminder to patient",
        "guid": "49458413-8A6A-7717-E71D-B9F6107E9840",
        "modifiedDateTime": "2021-08-18 17:10:29",
        "clientGuid": "59B40EB0-67E7-D153-28B0-C5CA92FFCD1B",
        "loggedUser": "ed.est",
        "createdDateTime": "2021-08-18 10:08:29"
    },
    {
        "comments": "Health Coach sent patient a reminder",
        "guid": "069C874D-F02B-6C4D-F392-8A8FAFB1F112",
        "modifiedDateTime": "2021-09-07 18:54:55",
        "clientGuid": "59B40EB0-67E7-D153-28B0-C5CA92FFCD1B",
        "loggedUser": "ed.est",
        "createdDateTime": "2021-09-07 11:09:55"
    },
    {
        "comments": "Daily readings check text reminder sent from health coach.",
        "guid": "A87E35A6-40E2-831A-1BB2-AFCC1418EF1E",
        "modifiedDateTime": "2021-08-28 12:25:14",
        "clientGuid": "59B40EB0-67E7-D153-28B0-C5CA92FFCD1B",
        "loggedUser": "eri.bro",
        "createdDateTime": "2021-08-28 05:08:14"
    },
    {
        "comments": "Health Coach sent missed reading reminder.",
        "guid": "2CA68FDB-62EB-80F4-B9F6-93C177BDC8D5",
        "modifiedDateTime": "2021-09-30 16:29:15",
        "clientGuid": "59B40EB0-67E7-D153-28B0-C5CA92FFCD1B",
        "loggedUser": "ed.est",
        "createdDateTime": "2021-09-30 09:09:15"
    },
    {
        "comments": "Health Coach called patient, patient is not home at the moment, will get reading done in the evening",
        "guid": "1238A028-1788-B6CA-BDEC-3D1152448F9D",
        "modifiedDateTime": "2021-08-23 17:08:36",
        "clientGuid": "59B40EB0-67E7-D153-28B0-C5CA92FFCD1B",
        "loggedUser": "ed.est",
        "createdDateTime": "2021-08-23 10:08:36"
    },
    {
        "comments": "Health Coach called patient, no answer, LVM, sent message",
        "guid": "4EB3C75D-497C-F2BA-9395-A4AE84391887",
        "modifiedDateTime": "2021-09-29 17:19:45",
        "clientGuid": "59B40EB0-67E7-D153-28B0-C5CA92FFCD1B",
        "loggedUser": "ed.est",
        "createdDateTime": "2021-09-29 10:09:45"
    },
    {
        "comments": "Health coach daily text reminder sent.",
        "guid": "A9B668C5-32C6-2D6B-ABD8-1FAF03C599CC",
        "modifiedDateTime": "2021-08-09 16:14:48",
        "clientGuid": "59B40EB0-67E7-D153-28B0-C5CA92FFCD1B",
        "loggedUser": "eri.bro",
        "createdDateTime": "2021-08-09 09:08:48"
    },
    {
        "comments": "Health coach text reminder sent.",
        "guid": "D9F7335A-F0CC-E33D-4376-AACDE48B1FE3",
        "modifiedDateTime": "2021-09-07 13:21:42",
        "clientGuid": "8D7764F7-C655-5E1D-9871-C95C4CAA2484",
        "loggedUser": "eri.bro",
        "createdDateTime": "2021-09-07 06:09:42"
    },
    {
        "comments": "I have tried calling the 2nd phone number that Corey got. I get no answer. I think we should discharge her.",
        "guid": "09C56971-AC0F-C80C-74AB-DC5785934014",
        "modifiedDateTime": "2021-05-02 18:36:49",
        "clientGuid": "5DB91098-163A-A7E6-A2BC-BE7FF2049765",
        "loggedUser": "ter.bmo",
        "createdDateTime": "2021-05-02 11:05:49"
    },
    {
        "comments": "pts PCP gave me a second contact number for pt.  the number is for pts mother Patti who resides with pt.  this number has been added to the system as the 2nd contact number",
        "guid": "0E4B56D2-93E7-66C2-CF39-3D33B354A0D5",
        "modifiedDateTime": "2021-04-26 11:37:38",
        "clientGuid": "5DB91098-163A-A7E6-A2BC-BE7FF2049765",
        "loggedUser": "cor",
        "createdDateTime": "2021-04-26 04:04:38"
    },
    {
        "comments": "Supplies Sent 9/22/21",
        "guid": "73F3244B-5D9D-FB1E-69B0-3F630013586C",
        "modifiedDateTime": "2021-09-22 10:19:08",
        "clientGuid": "5DB91098-163A-A7E6-A2BC-BE7FF2049765",
        "loggedUser": "cal.jmo",
        "createdDateTime": "2021-09-22 03:09:08"
    },
    {
        "comments": "Health coach daily reading reminder sent to patient.",
        "guid": "82C33D16-C425-9609-282E-ADEB692503BC",
        "modifiedDateTime": "2021-09-21 19:38:06",
        "clientGuid": "5DB91098-163A-A7E6-A2BC-BE7FF2049765",
        "loggedUser": "mar.vam",
        "createdDateTime": "2021-09-22 12:09:06"
    },
    {
        "comments": "Health coach daily text reminder sent.",
        "guid": "279C188C-A6E7-B4D5-A70A-6B98455855BA",
        "modifiedDateTime": "2021-08-16 10:35:15",
        "clientGuid": "5DB91098-163A-A7E6-A2BC-BE7FF2049765",
        "loggedUser": "eri.bro",
        "createdDateTime": "2021-08-16 03:08:15"
    },
    {
        "comments": "patient requesting supplies.  address verified.",
        "guid": "B84F1336-CA74-5F8B-8B8F-9B65FE6F4BA8",
        "modifiedDateTime": "2021-09-14 09:33:57",
        "clientGuid": "C2B3B592-0F24-A1B7-B77D-D4236821BF24",
        "loggedUser": "mar.vam",
        "createdDateTime": "2021-09-14 02:09:57"
    },
    {
        "comments": "Supplies Sent 9/30/21",
        "guid": "3E798A11-50D1-97EC-5C43-6F2BB2309FB6",
        "modifiedDateTime": "2021-09-30 09:11:02",
        "clientGuid": "5DB91098-163A-A7E6-A2BC-BE7FF2049765",
        "loggedUser": "cal.jmo",
        "createdDateTime": "2021-09-30 02:09:02"
    },
    {
        "comments": "Health coach call made to Pt. regarding compliance, left a vm.",
        "guid": "D0F7E1D8-6AC3-A1AD-2042-F46137934569",
        "modifiedDateTime": "2021-04-08 14:16:00",
        "clientGuid": "5DB91098-163A-A7E6-A2BC-BE7FF2049765",
        "loggedUser": "eri.bro",
        "createdDateTime": "2021-04-08 07:04:00"
    },
    {
        "comments": "Patient no longer lives at 2836 Ballington Dr apt 412. \r\nHer neighbors told me she was evicted.",
        "guid": "BC4504BC-BCA8-D4E6-5C46-2302CFE3B674",
        "modifiedDateTime": "2021-04-22 13:35:15",
        "clientGuid": "5DB91098-163A-A7E6-A2BC-BE7FF2049765",
        "loggedUser": "ter.bmo",
        "createdDateTime": "2021-04-22 06:04:15"
    },
    {
        "comments": "Pt. has informed me that she is in the hospital concerning her BS that she has not been monitoring. I am working with her on finding her a women's shelter she can temporarily stay in till she gets back on her feet.",
        "guid": "5BE8F1D6-7FE0-BE76-9132-3CB80A4AD7B6",
        "modifiedDateTime": "2021-05-04 17:02:27",
        "clientGuid": "5DB91098-163A-A7E6-A2BC-BE7FF2049765",
        "loggedUser": "eri.bro",
        "createdDateTime": "2021-05-04 10:05:14"
    },
    {
        "comments": "I called this morning and left a 2nd vm with Pt. mom. Update Pattie the Pt. mom called me back stating that her daughter is in emotional distress and does not have stable living conditions. Pattie informed me that Pt. ex boyfriend attempted suicide and left her evicted from apartment and Pt. has been depressed ever since. Pattie and I are going to attempt to reach out to Pt. and get her to call us and see what we can do to get her back on track with staying at a women's shelter. I would like to give this Pt. some time with program and help her get back on track with a healthy lifestyle and safe living conditions.",
        "guid": "67F133B1-FF72-B042-D3A8-5C5024140712",
        "modifiedDateTime": "2021-05-03 10:15:03",
        "clientGuid": "5DB91098-163A-A7E6-A2BC-BE7FF2049765",
        "loggedUser": "eri.bro",
        "createdDateTime": "2021-05-03 02:05:19"
    },
    {
        "comments": "Patient has moved.  She does not respond to calls.  Corey gave me a number for her mom.  No answer there either.  I think we need to discharge her.  We may out be able to recover the device.",
        "guid": "3374DEA4-E11D-D565-9813-13735C94226C",
        "modifiedDateTime": "2021-05-03 11:18:13",
        "clientGuid": "5DB91098-163A-A7E6-A2BC-BE7FF2049765",
        "loggedUser": "ter.bmo",
        "createdDateTime": "2021-05-03 04:05:13"
    },
    {
        "comments": "3rd time to get to the patients home and she was not there. Her neighbor saw me knocking on the door, she told me Ms.Ochoa was no longer living there, sheâ€™d moved out in the last month. Iâ€™ve called several times and left messages, no response from the patient.",
        "guid": "F131CECC-05D3-F705-758D-F1ECEB9F8548",
        "modifiedDateTime": "2021-04-23 09:55:24",
        "clientGuid": "5DB91098-163A-A7E6-A2BC-BE7FF2049765",
        "loggedUser": "ter.bmo",
        "createdDateTime": "2021-04-23 02:04:24"
    },
    {
        "comments": "Health coach reminder sent.",
        "guid": "C8E7FC9F-819E-DC4E-8B10-B3645F183E34",
        "modifiedDateTime": "2021-08-12 16:18:46",
        "clientGuid": "8E347ADC-B057-B7BA-B13B-914824036C97",
        "loggedUser": "eri.bro",
        "createdDateTime": "2021-08-12 09:08:46"
    },
    {
        "comments": "Diabetic testing supplies being sent today.",
        "guid": "E17B8695-BE3E-357B-D6C3-814F6222CD1D",
        "modifiedDateTime": "2021-05-11 16:46:31",
        "clientGuid": "8E347ADC-B057-B7BA-B13B-914824036C97",
        "loggedUser": "eri.bro",
        "createdDateTime": "2021-05-11 09:05:31"
    },
    {
        "comments": "pt reports that he is in the hospital.",
        "guid": "E2D051A6-51AB-151E-00F0-8CAFA8CD3A5C",
        "modifiedDateTime": "2020-10-05 12:24:20",
        "clientGuid": "8E347ADC-B057-B7BA-B13B-914824036C97",
        "loggedUser": "cor",
        "createdDateTime": "2020-10-05 05:10:20"
    },
    {
        "comments": "Patient stated he has not been feeling well and that is why he has slipped on checking vitals. He stated he would check today and that he needed DM supplies mailed out to him, he is almost out.",
        "guid": "F36A6C99-91D0-8400-9BB7-AE8E5704848F",
        "modifiedDateTime": "2021-07-27 13:03:47",
        "clientGuid": "8E347ADC-B057-B7BA-B13B-914824036C97",
        "loggedUser": "eri.bro",
        "createdDateTime": "2021-07-27 06:07:47"
    },
    {
        "comments": "Health Coach sent missed reading reminder.",
        "guid": "635F39FD-A729-5C5B-1B7C-86FB585F1594",
        "modifiedDateTime": "2021-09-15 18:56:16",
        "clientGuid": "8E347ADC-B057-B7BA-B13B-914824036C97",
        "loggedUser": "mar.vam",
        "createdDateTime": "2021-09-15 11:09:16"
    },
    {
        "comments": "Health Coach daily reading reminder sent to patient.",
        "guid": "7FFDD37E-1F9D-DCD9-C0DD-C3CC5EC65E3F",
        "modifiedDateTime": "2021-09-10 17:25:54",
        "clientGuid": "15EB8219-838B-776E-2003-555D03E2355F",
        "loggedUser": "ed.est",
        "createdDateTime": "2021-09-10 10:09:54"
    },
    {
        "comments": "Health Coach daily reading reminder sent to patient.",
        "guid": "F5ACE764-B77A-439B-DA17-B2AAB02D581B",
        "modifiedDateTime": "2021-09-09 16:20:52",
        "clientGuid": "15EB8219-838B-776E-2003-555D03E2355F",
        "loggedUser": "mar.vam",
        "createdDateTime": "2021-09-09 09:09:52"
    },
    {
        "comments": "Health Coach Director, daily reminder sent to patient.",
        "guid": "096499D5-C730-78C1-C1F3-5C2A4A1ABFC3",
        "modifiedDateTime": "2021-09-10 19:53:14",
        "clientGuid": "15EB8219-838B-776E-2003-555D03E2355F",
        "loggedUser": "mar.vam",
        "createdDateTime": "2021-09-11 12:09:14"
    },
    {
        "comments": "Supplies Sent 9/2/21",
        "guid": "4EDFF561-BFC1-5216-CA08-E6F0874B3407",
        "modifiedDateTime": "2021-09-02 09:50:24",
        "clientGuid": "15EB8219-838B-776E-2003-555D03E2355F",
        "loggedUser": "cal.jmo",
        "createdDateTime": "2021-09-02 02:09:24"
    },
    {
        "comments": "Patient called Health Coach to request DM supplies, Caleb has been informed to ship it out to patients PO box",
        "guid": "2AC92DA7-3B1B-464C-CB67-FFB42DC6D856",
        "modifiedDateTime": "2021-09-24 10:09:03",
        "clientGuid": "B050EF54-7162-9006-8249-94AFCD2C4A19",
        "loggedUser": "ed.est",
        "createdDateTime": "2021-09-24 03:09:03"
    },
    {
        "comments": "pt called yesterday to report that the monitor is not working properly to check BS.  Our staff member went there to assess but pt was not home.  Will follow up.",
        "guid": "2681E7F6-83D8-6295-1E69-F7D407142D01",
